,text
0,klobuchar ends bid set to join buttigieg in biden endorsement ahead of super tuesday … 
1, how about klobuchar and buttigieg going again it midwestern nice style
2,buttigieg and klobuchar prepare to endorse biden aiming to slow sanders 
3,pete buttigieg reportedly called joe biden before dropping out but called the wrong number here is what he said… 
4,a good read mayor pete was good for the left 
5,obama nudged buttigieg in direction of biden endorsement via 
6,pete buttigieg to endorse joe biden at texas rally ahead of super tuesday via _
7,leaked audio: voicemail details mayor pete’s call to joe biden to discuss “our plans” hours before buttigieg droppe… 
8,a moonlighting reboot but with klobuchar and buttigieg
9,trump: primary 'rigged' against sanders 
10, with both buttigieg & klobuchar dropping out has a legitimate chance at the… 
11, well… he’s the expert so he should know it’s interesting how he equates amy klobuchar and p… 
12,class act: pete buttigieg to endorse after dropping out of presidential race: ap via 
13, i was thinking that today when i saw klobuchar and yesterday buttigieg suspended their campaigns 😅
14, biden is the frontrunner now bernie only had delegates on hi… 
15, biden has delegates bernie has warren has in order for a candidate to get the nomination ou… 
16, _diaz _polls _inc low information voters might still vote for buttigieg he’s still on the ballot
17,biden of the remaining candidates never really had beef with klobuchar or buttigieg thus makes sense why he is… 
18,here's a pitch for a new show to fill the slot: the steve kornacki / pete buttigieg power hour
19,trying to figure out how my dad is both a / truther and a buttigieg supporter
20,pete buttigieg and amy klobuchar are throwing their support behind joe biden after dropping out of the race th… 
21,"colorado _inc poll (//):
sanders %
warren %
buttigieg %
biden %
bloomberg %
klobuchar %
othe… "
22,klobuchar buttigieg to join raekwon the chef on stage on super tuesday eve
23,and then warren and buttigieg call themselves progressives and say they stand for the same things but then will not back him
24, smart move by joe biden and we need super smart people like pete buttigieg young… 
25, voted early in nc hubby and i split our votes buttigieg and biden
26,aha february data says buttigieg's supporters report their second choice as % warren % bloomberg % biden… 
27,this is the best article i’ve ever read 
28, _michaelson oh you mean like warren and buttigieg supporters did bernie supporters
29, from the beginning before biden even officially joined the campaign i’ve said the ticket is biden… 
30, she lost to buttigieg in sc and got fewer black voters than him he's an overt racist and she picked… 
31, wasn’t perfect but he was brave stanford politics’ very own reflects on buttigieg’s hi… 
32, buttigieg's at home on line picking his new house out right now 😂
33, my dad just pinged me saying he is super angry as he pre voted buttigieg in cali just before he dropped
34, i got different mailers in as many days from bloomberg last week been getting texts from biden… 
35,steyer buttigieg klobuchar and now chrismatthews: this weekend’s death toll on the left is staggering
36,<for months> “buttigieg is a rat faced ratty rat i bet he eats cheese whatta little rat with a dumb rat dance im… 
37,_diaz _polls _inc i do not think that'll actually be the case as buttigieg is set to endor… 
38, tunedin for buttigieg and klobuchar commentary instead got this stunning turn of events
39,on politics: biden reshuffles the race 
40,so i just saw buttigieg pictures with a beard and i having feelings suddenly
41,lmao fuck off via 
42,_cammm obviously it does not help to remove trump to not have those votes but it also does not help these peo… 
43,well it looks like democrat voters and politicians are talking up joe biden that’s why buttigieg dropped out they… 
44,bernie when biden was endorsed by both buttigieg and amy whatever her name is 
45, we need pete buttigiegeric swalwellhakeem jeffrieskamala harrisjo… 
46,isn’t it f’d up that if your a buttigieg or klobuchar supporter in a super tuesday state that the donors made the c… 
47,preps inside for dallas tx biden rally w klobuchar buttigieg 
48,"msnbc’s chris mathews is set to retire after a week of antisemitic sexist and racist commentary

too bad we’l… "
49,i’m just a ball of emotions right now too much unfolding buttigieg klobuchar hardball supertuesdayeve
50,_joseph i just listened to on bernie and his surrogates are becoming more t… 
51,amy and pete samaritan howard stern sanders trump dow jones air force one emily's list zaza spirited away trina but… 
52,hardball with pete buttigieg 
53, … 
54,trump claims democratic primary &;rigged&; against sanders after klobuchar buttigieg drop out… 
55, i predict within the next decade there will be a buttigieg presidency
56,"trying to get in the mindset of someone who's undecided on biden but then thinks ""well if pete buttigieg says so"""
57,"davidpakmanshow petebuttigieg pete 
pete buttigieg drops out in obvious plan to help biden 
… "
58,petetobernie is a thing bc many buttigieg supporters didn’t support him because he’s moderate we supported him bc… 
59,bloomberg nor buttigieg can be my president i require a philtrum neither has one dealbreaker
60, its legitimately why buttigieg never had a chance
61,"and of course iowa: 



"
62,i just asked two family members a trump supporter and a bernie supporter what they think of buttigieg klobucha… 
63,klobuchar dropping out good riddance buttigieg gone good america needs a progressive it's time for a c… 
64, they're way too high on bloomberg there's a good chance that buttigieg and klobuch… 
65,"our buttigieg coverage:


we would argue it's all you need "
66, biden will pick buttigieg then he can stop reminding us about being friends with ob… 
67, i heard that pete buttigieg could run again in and he'd still be younger that joe and bernie are now
68,"i will never ever mark ""bernie sanders"" on my ballot i'll write in pete buttigieg instead "
69,san francisco :: san francisco :: pete buttigieg’s historic candidacy is over where do gay rights groups want to g… 
70," president: joe biden

vp: kamala harris

attorney general: adam schiff 

vp: secretary of hud

secret… "
71,"sanders agrees with trump: ""they're staging a coup against bernie""
"
72," i know fake news will never be the same 
maybe they'll replace him with mayor pete and call it t… "
73,buttigieg and klobuchar dropped out i’m surprised
74,things that have happened since juvenile came back into our lives: steyer dropped out buttigieg dropped out klobu… 
75,amy klobuchar and pete buttigieg endorse joe biden that's it that's the tweet
76,if you were previously going to vote for buttigieg or klobuchar who are you going to vote for now and why… 
77, he really is a pos course they will just bring in another ultra lib to takes his place maybe buttigieg or amy will get a job
78, million democrats have already voted in super tuesday states it’s not fair that all those votes are “locked in”… 
79, liz please drop out we are begging you here for the sake of the progressive movement but… 
80,"""buttigieg and klobuchar prepare to endorse biden aiming to slow sanders"" by alexander burns jonathan martin and… "
81,source: buttigieg to endorse biden at monday rally 
82, replaced with pete and it will be called “softballs with pete buttigieg”
83,“this is the real beginning of the dems taking bernie out of play – no nomination again” the president wrote on t… 
84, _michaelson almost as classy as the peter paul buttigieg gay joke… 
85,welcome to the new host of msnbc hardball pete buttigieg
86,buttigieg is kissing the ring of a senile man who definitely still uses homophobic slurs from the s after his… 
87,buttigieg and klobuchar to endorse joe biden; harry reid also backs former vice president 
88,_amene unlike kamala harris who has a pretty darned great job of us senator that presumably she’ll… 
89,do not care who you support today (for me its ) i guarantee youthere will be a day when we have a… 
90,pete buttigieg dropped out in disgrace chris matthews was forced out of msnbc and bernie is going to win super tu… 
91,_in_nc uh buttigieg had more than times the delegates has and he dropped… 
92,"_tom if bernie is their candidate the ""down line voting"" is what's got them worried obama lost seats… "
93,"amy klobuchar drops out of presidential race will endorse biden nbc news

amy klobuchar drops out of presidentia… "
94, it’s certainly not seemed to impact him much thus far steyer might have had more bernie vote… 
95,: reuters : buttigieg to drop out of democratic nomination race day after big biden win 
96,) buttigieg dropped out and homophobia cost him the primary race as a trump supporter unfortunately we have an… 
97,what is the real story of buttigieg's service and time in afghanistan 
98, biden was vp for years he will bring integrity and honor back to the white house i would like to… 
99, got that pete buttigieg smile
100,man dies after years from testicular hemorrhages despite begging the internet for help when mr ate his balls t… 
101,add this trump lie to the over other lies ge’s told trump falsely accuses biden of quid pro quo after butt… 
102,buttigieg and klobuchar prepare to endorse biden aiming to slow sanders 
103, not necessarily that more the idea that obam… 
104,"are the dems shooting themselves in the foot
"
105,obama phone call encourages buttigieg to use his ‘considerable leverage’ amid rumors of biden endorsement: report 
106,pete buttigieg drops out how this could impact the race via 
107,"pete buttigieg is set to endorse biden 

looks like sniffing pete’s hair paid off for you joe🤷🏻‍♂️😏😂"
108,president donald trump accuses democrats of a coup against bernie sanders claiming moderates amy klobuchar and pete… 
109, i said this to my warren supporting friend last night when the sc results were in and… 
110,the corrupt establishment dems & trying to steal the nomination from again bernie… 
111,hey amy and pete samaritan howard stern sanders trump dow jones air force one emily's list zaza spirited away trina… 
112,buttigieg and klobuchar prepare to endorse biden aiming to slow sanders 
113, it always breaks my heart knowing his dad dr joseph buttigieg translated the phenomenal gramsci into… 
114, i think *two* rcvs might be useful to give buttigiegtype candidates (or any governor south o… 
115," incorrect obama did not say that it clearly says that buttigieg ""can"" make a challenge for bernie"
116,imo the moderate dems are consolidating around the candidate least likely to beat trump i think both klobuchar an… 
117,"today’s news cycle:
klobuchar out
joint appearance with buttigieg () to endorse biden
chris matthews resigns
c… "
118,"a vote for warren = a vote for biden = a vote for trump
damn it people are dying from lack of healthcare and the p… "
119, you guys are so transparent a lot of dems can see that bernie just isn’t what we need in… 
120,"predator trump is accusing pete buttigieg and amy klobuchar of committing a quid pro quo with joe biden

🤣🤣🤣🤣🤣🤣🤣🤣🤣… "
121,mayor pete was good for the left 
122,pete buttigieg drops out of presidential race 
123,joe biden just confirmed pete buttigieg will be a part of his administration via 
124,nolte: pete buttigieg‘s failed campaign was built on hate and lies via 
125,interesting piece on how homophobia played a part in pete's defeat 
126,pete buttigieg reportedly called joe biden before dropping out but called the wrong number here is what he said… 
127,maybe biden arraigned for some high paying positions on advisory boards for klobuchar and buttigieg to clinch their endorsement 
128, yes and i like elizabeth warren a lot too but pete is throwing his support to biden and will endorse… 
129,this article is refreshing it mostly reflects how i feel about pete 
130,joe scarborough likens buttigieg to george washington and frank sinatra topbuzz 
131,"trump accuses buttigieg klobuchar of 'quid pro quo' with biden via 
trump would know about quid pro quo"
132,pete buttigieg dropped out of the presidential race and homophobia helps explain why 
133,biden nabs klobuchar buttigieg backing on super tuesday eve (from ) 
134,here’s the trouble with early ballots 
135, pete buttigieg had more delegates than warren and he dropped out why is bernieendorsewarren trending
136,breaking: dead in the us from coronavirus: tune in & learn how islam has been invading europe for over years… 
137, i get it we all want to win but it’s a different game for her with buttigieg and klobuchar s… 
138,does buttigieg think he will get a cabinet post if biden were to win klobuchar is looking for the vp spotmaybe 
139,pete buttigieg drops out of race what's next 
140," ""buttigieg fix is in"""
141,pete buttigieg and amy klobuchar are throwing their support behind joe biden after dropping out of the race th… 
142,"""they are really getting nervous that working people are standing up""

sen bernie sanders claims ""there is a mass… "
143, pete buttigieg just found his new job
144,my biggest regret is not being responsible for buttigieg's failure
145,"buttigieg and klobuchar to endorse joe biden; harry reid also backs former vice president 

corn pop is the democra… "
146,"i'm almost through cutting onions and get that vile creature outta our house

critics saw buttigieg as a sellout w… "
147,nolte: pete buttigieg's failed campaign was built on hate and lies 
148, why did bernie have grey hair years ago jesus—he was buttigieg age in this
149,i don’t know how to pronounce buttigieg and at this point i’m afraid to ask
150,"mike bloomberg says he spoke to pete buttigieg and amy klobuchar: ‘i’m in it to win it’ | nbc news
"
151,honestly can not think of anyone's supporters i have liked more at baseline than buttigieg supporters (i like a lot… 
152,report: pete buttigieg likely to endorse joe biden via 
153, with klobuchar and buttigieg out warren should get % in most places
154, _due dude soon as that video is up i will be sharing it was legit crazy moore wa… 
155,buttigieg klobuchar will endorse biden in dallas tonight; here’s what that means for the race 
156, haha tbh i liked her patter more than buttigieg (mentioning her service… 
157, i knew buttigieg had no chance because gmail didn’t recognize the spelling
158,"i keep seeing posts claiming that buttigieg & klobachar dropped out to ""steal"" the primary from bernie if their vo… "
159, biden for prez warren vice prez buttigieg for secretary of state
160," presidential election news update🗞:
klobuchar buttigieg set to endorse biden after dropping out
election… "
161,buttigieg fell short of his goal to win the democratic nomination and defeat president donald trump but his candid… 
162,💬amy klobuchar pete buttigieg rally behind joe biden on eve of crucial super tuesday contests … 
163,i figgered all along that kobuchar and buttigieg were just distractors introduced to try to weaken sanders in favor… 
164,joe biden says if he wins he'd ask pete buttigieg 'to be part of an administration' topbuzz 
165,"oh please 🙄
quiter was not in the race long enough ( of states) for homophobia to be an impact

"
166,"jeez buttigieg steyer and klobuchar are out and chris matthews just quit ""hardball"" and walked out after his mi… "
167, pete buttigieg to replace him
168,pete buttigieg and amy klobuchar committed political suicide by dropping out of the race before super tuesday and endorse creepy joe biden
169, buttigieg and klobuchar to endorse biden • opinion: klobuchar's exit is a strong 
170,analysis: welcome to the grand old democratic party 
171,“ mike bloomberg: four issues that could derail his white house bid – video” 
172,klobuchar buttigieg to join biden on stage on super tuesday eve via 
173,klobuchar buttigieg to back biden at rally in super tuesday state of texas 
174,pete buttigieg pulls out of democratic presidential race (via _ie) 
175, buttigieg and klobuchar to endorse biden • opinion: klobuchar's exit is a strong 
176,damn biden better win this thing pete mf'ing buttigieg is the man 
177,we got rid of buttigieg klobuchar and chris matthews in hours retrograde is taking out the trash do y’all h… 
178, buttigieg and klobuchar to endorse biden • opinion: klobuchar's exit is a strong 
179,klobuchar buttigieg to join biden on stage on super tuesday eve 
180,what’s next for pete buttigieg few expect mr buttigieg the former mayor and now former presidential candidate t… 
181, i just tweeted something about moore's tinfoilhatcrazy tirade on the beat he's going off on… 
182, 😔😔😔😔😔😔😔😔😔😔😔 buttigieg drops out styer drops out the coronavirus and now not my chris matthews 😔😔😔😔 
183,sources: klobuchar & buttigieg to endorse biden tonight; bloomberg on the ballot for the first time as democrat tom… 
184,if buttigieg endorses biden it just proves (yet again) how fucking corrupt and out of touch the dnc is they did t… 
185," it's called selling your soul i'm pretty certain that buttigieg and klobuchar both received some ""… "
186,i hope there’s some drama at the biden+klobuchar+buttigieg rally tonight i’m bored
187,“mike bloomberg the former new york city mayor is pouring almost half a billion dollars of his vast fortune into… 
188, all the people in this thread saying kamala harris good for you she is great however there was a l… 
189,tom steyer pete buttigieg an amy klobuchr ended their campaigns joe biden bernie sanders should end their campaigns
190,in hours bernie has broken up public enemy made chris matthews retired and ended pete buttigieg and amy klobu… 
191,what's going on how pete buttigieg went from winning iowa to withdrawing from the presidential race south bend t… 
192, i was a buttigieg supporter i'm still disgusted at biden who pandered for votes in by going geese… 
193,the deep state/dnc has made their pick”report: pete buttigieg likely to endorse joe biden” 
194,"making the connection in texas between early voting and ranked choice voting 

hundreds of thousands of such indiv… "
195, hey chumpu better get a good lawyer buden going to make senator harris agyou and all ur cr… 
196,why maga is a lie according to pete buttigieg 
197,pete buttigieg might be the most progressive candidate ever to run for president | charles kaiser 
198," three months ago i would have chosen bernie after harris warren buttigieg 

now no 

biden

it… "
199,i think the hope was that if all of us were going to be expected to support biden or buttigieg if they want the nom… 
200,"i guess this is her ""bitchy"" side showingmarianne williamson rips buttigieg klobuchar for endorsing biden "
201, if you're following what you're saying and would vote for buttigieg over sande… 
202,true: buttigieg warned “we’re not going to win these critical critical house and senate races if people in those… 
203, _smith buttigieg: vp& va he could do both 🤷🏼‍♀️
204,"""buttigieg and klobuchar prepare to endorse biden aiming to slow sanders"" by alexander burns jonathan martin and… "
205,buttigieg dropped out klobuchar is dropping out and chris matthews is finally leaving msbnc i j keep winning~
206,"msnbc executives already calling buttigieg to see if he's interested in joining the network and getting a show

i am speculating"
207,any comments or suggestions for buttigieg 
208,"cc: minnesotans who voted early for klobuchar or buttigieg

"
209, voted early for buttigieg but if could vote tomorrow biden
210,i've seen two buttigieg and klobuchar commercials tonight this feels like when i wish a happy birthday to someone… 
211,"my buttigieg coverage: 

dnc bid: 
the run: 
the launch:… "
212,how paddy gower and pete buttigieg are the same 🐀🐀🐀 
213, no need for the abuse his platform is a lot closer to bernie’s tha… 
214,klobuchar and buttigieg making national fools of themselves during their presidential bids and promptly running to… 
215, softball with pete buttigieg
216, i do not know if bernie is the inly person who can win that campaign but i have zero faith in either bid… 
217,trump falsely accuses biden of quid pro quo after buttigieg and klobuchar drop out 
218,point but now with buttigieg and klobuchar so obviously throwing immediate support to biden it smells as thou… 
219,let's just hope more than those who turn to biden smartnews
220, buttigieg was merely a trial balloon for a gay presidential hopeful by the dems he or some equivalen… 
221,buttigieg set to endorse biden as super tuesday looms smartnews
222,nolte: pete buttigieg’s failed campaign was built on hate and lies via 
223,at the biden/klobichar/buttigieg rally it's a bunch of boomers waiting get into the opening night of a high schoo… 
224,ok so re: cbsnews biden may offer a position to buttigieg yet says klobuchar had a great race double standa… 
225," ’s day so far:

 amy klobuchar drops out
 amy and pete buttigieg both endorsing joe bid… "
226, secretary of education chase buttigieg
227,“i think both of them behaved themselves is a nice way to phrase it” former new york mayor bloomberg said somewh… 
228,"rhony alum bethenny frankel gets dragged for pete buttigieg joke gone wrong

"
229,consider this: pete buttigieg and amy klobuchar hated each other so much because they're both doms and they were tr… 
230,with buttigieg and klobuchar rallying around biden tonight it’s now the midwestern and suburban democrats in a thr… 
231, @_itsjustasia_ i think both buttigieg and klobuchar dropped out to keep from getting buried tomorrow… 
232,pete buttigieg and amy klobuchar both look like characters from that knockoff ratatouille movie ratatoing
233,whatever he wants what's pete buttigieg going to do next cnn politics 
234,what was the payoff for buttigieg and klobuchar democrat establishment is scared to death of bernie as should th… 
235," ummm 
quid pro quo for political appointments is (spoiler alert) politics the secr… "
236, who managed buttigieg
237,opinion | mayor pete flew sky high the new york times 
238,critics saw buttigieg as a sellout who tugged democrats to the right in reality he did the opposite 
239,first buttigieg then klobuchar and now chrismatthews just announced he's also suspending his campaign for president
240,buttigieg was never ever a moderate despite what the moronic analysts on tv say 
241,warren swaps with buttigieg to speak at boise democratic gala 
242,"warren called out buttigieg's powerpoint and klobuchar's postit note on health care 

and chris matthews question… "
243,buttigieg set to endorse biden via 
244,trump falsely accuses biden of quid pro quo after buttigieg and klobuchar drop out 
245,the dropping out by steyer buttigieg and klobuchar is nothing but timing for tomorrow's supertuesday itdoesnttakeanidiot
246,when msnbc replaces chris matthews with pete buttigieg
247,"daddy porn: 

obama/buttigieg 

just sayin'"
248,why pete buttigieg should be dnc chairman 
249, biden and buttigieg just what the dems need two boring white guys 🙄
250, _bond this comment is just nuts how many berni… 
251,there may be plenty of second chances in life but there are very few when it comes to voting — a bitter pill to sw… 
252,"""buttigieg and klobuchar prepare to endorse biden aiming to slow sanders"" by alexander burns jonathan martin and… "
253,"no shyt we see you 
noblackagendanovote
ados
pete buttigieg plans to endorse joe biden for the democratic pr… "
254,"hummm

that makes trump the youngest in he the race

"
255,"whoa 😲
buttigieg: out
klobuchar: out
chris matthews: out "
256, klob v buttigieg sounds like it’d end with bloodshed or withering stares
257,joe biden just confirmed pete buttigieg will be a part of his administration 
258,klobuchar buttigieg christ matthews gone in the past hours 
259,when did michael moore become such a whiny poopydiaper baby man he's going off on about some dem… 
260, _smith i see buttigieg as secretary of state
261,as one of her constituents and a bernie sanders supporter i'm glad to see amytobernie trending i absolutely pos… 
262, it's not the end of the world for them i hope to live long enough to see especially pete buttig… 
263," vote warren 

but i doubt she will get enough delegates 

we were warren 
then buttigieg 

but we're voting biden"
264,"so true

biden amyklobuchar buttigieg "
265,biden surges higher with klobuchar buttigieg endorsements 
266, have you ever read a single article from the new york times/washington post/a cn… 
267, making room for pete buttigieg perhaps :) 
268," klobuchar and buttigieg must be saying ""we dropped out for this"""
269,pete buttigieg to endorse my urethra glans foreskin shaft and balls for presidential nominee
270,_law imo most people who would have voted for klobuchar or buttigieg will prefer biden's moderate proposals… 
271,the presidential race starts a with smaller field of democratic candidates this week monday sen klobuchar d… 
272,pete buttigieg is heading to dallas tonight expected to publicly endorse former vice president joe biden for presi… 
273, his name is literally buttigieg i’m quite frankly surprised that there were not more assrelated jokes… 
274,bv tonight pm the democratic empire strikes back buttigieg and klobuchar drop out is it enough to help biden
275,"ben folds was a buttigieg supporter
ben folds was a buttigieg supporter
ben folds was a buttigieg supporter
ben fol… "
276,big teamjoe unity rally in dallas tonight featuring amy klobuchar pete buttigieg and joebiden bidenbounceback… 
