,text
0,_sammich kamala was the only candidate worse than bernie imo i'm actually shocked the most by how bad chief warren is doing
1, all going according to plan at nate silver's but let's see if the establishment's power play… 
2,"don’t give up on warren she hasn’t given up on you

warren
lfg"
3, i get that i'm just curious what the differences are that make you prefer her despite her being essential… 
4, good after tomorrow warren should drop out and endorse bernie and bloomberg needs to drop out… 
5, that’s in no way warren or sanders bloomberg is your best bet he can sway the voters from red to blue
6, i am with you on warren
7, stfudamn it rob i thought you of all men would get behind having a woman candidate for president el… 
8," emily warren ⁉️reallyyikes
adios and kissm’en tuchas 🤦🏻‍♀️"
9,if warren truly wants to be the nominee she has to be willing to do what's necessary to beat sanders: which means… 
10,"gonna go out on a limb and predict this order re total delegates won on supertuesday:

 biden
 bernie
 bloomberg 
 warren"
11, philosopher drucillacornell on elizabeth warren at the… 
12, just vote for whoever you want to brah like warren then vote for her like bernie then vote for h… 
13,"“a vote for warren is a vote for biden”

 no and considering biden is now my second choice it would be fine if yes"
14,"man oh man these sudden endorsements for biden from beto amy and presumably mayor pete sure are timely

shit non… "
15," oh but it is was mad chris was ""mean"" to warren so the misandrist tart decided to weap… "
16,i’m voting for elizabeth warren i believe in her so strongly i joined her texting campaign as a volunteer (someth… 
17,i am with warren the media did the job of questioning her electability so people who would have voted for her are… 
18, how about we choose the progressive that can actually win elizabeth warren is not projected… 
19, a warren/castro ticket would make me happycry that administration would b… 
20,do you want to know why amy and pete are out the dnc is a controlling forcepulling the reigns to control the vote… 
21, i voted for warren already i will vote blue
22," sanders needs delegates to win
biden needs 
warren needs 
this is… "
23, so what it’s not illegal to drop out for the good of the party they’re all moderates they’re a… 
24,"man chuck wendig calling people sexist for telling warren to drop is hilarious but also damn i like his books

m… "
25, it's because of this insidious bs that i'm voting for liz warren
26, we need warren we need someone who has actual plans and can get things done
27,"if i continue giving my support to warren i am “selfish & delusional”

if i choose to put my support behind bernie… "
28,join tonight's call to hear the plan for the warren campaign during march and beyond you'll hear from … 
29,if you choose warren tomm it’s a wasted vote i’m tired and it’s the truth
30, castro gillibrand inslee even klobuchar beto et al were more a… 
31,most warren supporters are caring thoughtful smart people with good intentions but the reality is she has no pat… 
32,_agust if warren was a true progressive she would quit and endorse sanders she is not
33,"""warren engineered bloomberg's fall from grace almost singlehandedly—proof positive that she has exactly what it t… "
34,no matter your sentiments of this issue is definitely important to keep in mind & to push warren to impro… 
35," pardon me what

 an elizabeth warren voter"
36,noooooooo come onnnnnnnnn can everyone just get behind warren or bernie or else shit ain’t gonna happen 
37, of course even that poll was taken before buttigieg and klobuchar dropped out so there’s no telling… 
38, good call only sanders and warren are left in the primary so this makes a lot of sense
39,i believe with all my heart that elizabeth warren would be a terrific president for all americans which is why i j… 
40,_ek for what it’s worth (and i love warren) i live in vt sanders is my senator he is every bit as authentic… 
41,all they need is warren to close the circle it really is notmeus vs the world 
42, warren supporters don’t act like this either whatever they are they can eat shit
43,"oh but it is was mad chris was ""mean"" to warren so the misandrist tart decided to weaponize it and mag… "
44,)explaining to my aunt that elizabeth warren has true ravenclaw energy) 
45, i’ll make an exception and retweet for her actually getting the question right after framing… 
46,_smear i would have to find the video online it was at an la event last november or october i do not remember… 
47, warren just isn’t a progressive she can be but she’s not right now
48, which is really bad because warren has no chance to win and is simply simply splitting the progressi… 
49,this is warren’s time to come through and snatch that top spot
50, don’t leave no i saw the moment with elizabeth warren who’s my number one you did fine you were… 
51,"elizabeth warren has my vote because i truly believe she’s the president we need 

i hope you consider voting for… "
52," ""if no candidate receives votes during the first roll call of states pledged d… "
53, _man it's peak privilege to base one's vote on mean twee… 
54," you could not think of anything more innovative to get retweets

i support both bernie and w… "
55,still crazy how trump gon win again cus dems split over bernie and warren and at this point it’s too late to say d… 
56, not wrong but we are on like plan g at this point so we've not a lot of options left unless warr… 
57," no how about bernie endorse senator warren much better 
make the woman lo… "
58, the rose emoji people feel super entitled to warren's endorsement what are you offering her she should… 
59,immediate update bloomberg: ; warren: ; everyone else: 
60, _monahan_jd i mean everyone in the race at the moment b… 
61, or warren
62,"_updates jane: and why aren’t you in uniform

lyin liz wrecker warren: "
63, yep they're calling because tomorrow is st but when i tell them i'm voting for biden because as muc… 
64, i’d rather have warren or biden over bernie & i’m very liberal and you’re right the… 
65, warren got burned when she was honest about the cost of ma i commend her for her tenaci… 
66, __ okay i was not doing that i do not see the value of doing this unity schtick with war… 
67,for the love of dog yes people the answer is right in front of you elizabeth warren needs out support 
68, if beating trump was as easy as cancelling him then he wouldn’t have even been elected in the first pla… 
69,i don’t think we will defeat trump with someone who still praises fidel castro who voted against the magnisky act… 
70, warren iscan idiotand she will not get the nomination
71,warren your time is coming it's just not right now
72," 🤣
poller coaster
can we all agree that's hilarious nmw you think warren shld do"
73, *while warren was a professor
74,"i pledge to vote for elizabeth warren in join me →
"
75, if we’re maybe possibly heading towards the oldest ever electe… 
76, matthews couldn’t be bothered to do a respectful professional post debate interview with warren witho… 
77,warren time to mention castro as your vp
78, warren for the sake of those of us who do not get to vote in the primary until the race is effectively… 
79," his new campaign song should be more today than yesterday opening line is ""i did not know what day it was"""
80, voted early for warren
81," warren is progressive sure but she’s backed off her progressive positions which is sad
 she h… "
82, whom alteady voted warren
83,when biden gets all the big endorsements in one day and bernie people who called warren a snake are now telling her… 
84," she was a warren supporter

"
85,"thank you for the reminder 

_rivera dropped some real sanderswarren wisdom on this month… "
86,this is an interesting ask from when you consider warren stuck out her neck to support two of their de… 
87, there's trump there's literal nazi's there's superboomer consistent election loser biden there's… 
88, i’m % voting for warren tomorrow but can i first saywhat
89, warren supporters are among the most thoughtful intelligent and fun in the electorate i just hope th… 
90,i’m attending warren for president’s event “text team for warren training” – sign up now to join me winwithwarren 
91,warren i am begging you drop out and endorse bernie it's our only chance
92, biden is just going to lose and warren not dropping out and endorsing bernie… 
93,i can not believe kloubuchar dropped out i guess the majority of delegates will go to biden biden warren sanders… 
94, if people vote their own mind all indicates that bernie will still win… 
95, hi outside source you reported that liz warren is the only female left in the democratic race what about tulsi gabbard
96, ryan for the millionth time you wonder why people think you are a warren shill stop making adam green look good
97, yep i am sick of joe winning one state and now it is a two man race i am voting warren
98,does warren even have a path to win
99, _joseph i’m still holding out for warren 💙
100," remember to do the math

buttigieg bleeding two percent to each of sanders biden and warren benefits w… "
101,"in case i have not mentioned it of late:
i am all in for warren"
102, because she’s truly the best candidate less polarizing than bernie it should come down to warren v b… 
103,contrary to the dated takes from sexist relics like chris matthews (best wishes) & donny deutsch warren’s ‘stride… 
104, translation: warren please do not help bernie
105, typical warren racist
106,vote for whoever you want but i personally think warren should've dropped out when she ran out of money rather than… 
107,the 'truth' about elizabeth warren 
108," warren dead ender

going to vote fo… "
109, you know damn well warren has zero chances of winning you are actively sabota… 
110, i'm a bernie supporter but i fe… 
111, i’m sticking with warren a little longer but if it comes down to sanders v biden then i am sanders all the way not even close
112,ahh and let’s not the fakest bitch of them all warren is 
113, i am still team warren she is the best candidate with the least baggage the oppo research trump use… 
114," totally agree

 and all others shut up with… "
115, i like bidenwarren with harris at ag bloombergcommerce steyert energy buttigiegveterans affairs sa… 
116,if you stand with warren please consider doing the right thing and voting bernie tomorrow so we have a better chan… 
117," warren
 biden
 whoever gets the nomination"
118, it's not about his supporters being annoying it's about *some of them* threatening to hand t**** a… 
119, a vote for warren is a vote for warren this is the p r i m a r y and only state have voted
120, i think warren would filet trump (eg bloomberg) and i think it’s a fantasy that bernie can woo former tr… 
121," ""you're a sexist if you tell warren to drop out""

(next tweet)

""tulsi gabbard amirite lmao"""
122,sanders/warren or biden/drop outpete 
123,choosewarren warren is not bernie they might agree on most of the important policies but not on how to lead chan… 
124, _for_warren if warren had been steward of gondor we would not have had all that unpleasantness
125, armed with that knowledge wouldn’t you as a person who cares abo… 
126,"also if biden becomes the nominee is it warren’s fault for not dropping out 
personally i don’t think so let her… "
127,"i'm disgusted warren has not dropped out and supported bernie yet

there's really just one thing to say… "
128, yeah warren has won as many delegates in the last three states as i have
129, opie he’s been rough for awhile he was extremely confrontational with warren after debate equated san… 
130,"warren's hearing aid bill reminds us of her long top donor medical device lobbyists: brown rudnick
medical device… "
131, i hope pelosi endorses warren
132,_donna nope to joy she’s apparently working for elizabeth warren 😡
133,_txt (if it was not clear she's voting for warren lmao)
134, warren should drop out
135, trump is making fun of warren it's actually pretty damn funny she can not win
136, every vote for warren is a log on the fire of “bernie’s not electable… 
137, _farmer i agree i thought warren should have went all in when pushe… 
138,"i'm sorry but both sanders and warren are too angry for me
want to make chage
awesome 
but would you *please s… "
139,me waiting on warren to denounce ice and apologize for lying about having native heritage: 
140, warren is not progressive though
141," when you say ""legitimately"" a democrat; what does that mean

because you kn… "
142,amy and pete drop out (helping biden) but warren (whose departure would help bernie) carries on classic exci… 
143,bernie and warren will mop up bloomberg and biden in the next debate yet i worry about warrens loyalties
144,_sam bernie is the real deal i've got too many questions about warren warrenendorsebernie
145, what states will warren win
146, warren i used to support you but obviously you don’t care about progressive ideas otherwise you would endorse bernie
147,whatever let the warren dumbasses keep throwing their “no states have voted yet” tantrums for the day after tomorro… 
148, _affect this frustrates me no end two small caucus states had an outsize influence on the ele… 
149, soon e warren
150, _chercrew … 
151,"_al lmao wut you think trump is a masterful debater that's really funny

biden may seem… "
152, he was sexist towards elizabeth warren and then someone he sexually harassed was inspired to say he did it
153,if biden’s the nominee he loses to trump bloomberg and warren can’t beat him either sanders is the only candidat… 
154,emily’s list endorses elizabeth warren for president | 
155, ex: without warren in the race chris matthews might still have his job
156, ya bernie sanders and elizabeth warren
157,@_woifgang just grateful we didn’t get a warren/khive merger
158,maybe we could have a copresidency warrensanders & make stacey abrams vp anyone 🦗🦗🦗🦗 🤷‍♂️seriously though v… 
159,bernie sanders campaign’s push to secure massachusetts and maximize his share of its delegates has surprised so… 
160, you are too nice warren close she voted for reagan twice case closed can you spell opportunistic attack dog
161, bernie has never ''slammed'' warren it's the opposite
162, warren is far from the best just like her little lie on the harvard application took the spot away fr… 
163, mark my words elizabeth warren betrayed progressives in she’s soft on her principles she is pa… 
164, i’m a democrat and i’m pragmatic there is no pathway for warren to win the nomination biden it is
165," _teresa exactly amy had no path and warren still does

you should r… "
166, why would bernie sanders at this point want to take any delegates from warren would not he instead want… 
167,bernie supporters making a “if warren can’t win don’t vote for her” plea is the actual definition of irony
168,"because representation only matters when it's convenient

"
169,elizabeth warren is the only candidate that can flip the scriptcnn
170, warren will not beat trump i like her but it will not happen biden is the one simple as that to… 
171,anyone who thinks a pete or klobuchar type candidate can beat this guy is delusional he rips warren as well and y… 
172,"endorsements current candidates have received (or are receiving) from former rivals:

biden: moulton ryan kl… "
173,"hmm 
wonder if this had anything to do with his impromptu exit
like warren i had my own sexist runin with chris… "
174, i’ve always been a warren girl please consider throwing your support her way thanks 😀
175, we love elizabeth warren and she would be a perfect vp nominee for bernie
176, % the party dictated all of this klobuchar was at her rally hrs ago pete won iowa sanders is wi… 
177,jesus fucking greasy crisco christbait elizabeth bernie jr warren has no path
178,"warren refused to endorse bernie in so she will absolutely not in she has support of many ""progress… "
179,here's what i've seen from the warren campaign re: communication i cannot wait to see this kind of competence comi… 
180, and about the democrat bashing: i like when he does that i like when warren d… 
181," this was written by a bernie troll 

warren supporters aren’t this vindictive"
182,and i love warren she is my nominee but she don’t have a chance
183,everyone is real quick to shout sexism at critiques of warren which is a factor but how about the fact that she u… 
184, and also where’s this warren attacking/distancing narrative coming from is it only that she has th… 
185,he bulldogs women and hes embarrassed himself multiple times apparently elizabeth warren was the last straw but he… 
186, she's only gotten delegates what universe are you all living in where she's… 
187, you forgot about the qualified and amazing candidate elizabeth warren it’s time for women to support other women
188,"she is electable when you vote for her

so vote warren 

 warren supertuesday"
189,if you think elizabeth warren would be the best president you should vote for her now she’s electable if you fuck… 
190,_aria_blooms the establishment goal is biden that means they have to destroy bernie which in turn mea… 
191, why not elizabeth warren 
192," wow lots of bernie trolls here

 i think it's only fair to get a call to drop out and endor… "
193,_benson too true i'm voting warren but i would not vote bernie tomorrow if she dropped out
194, if you like both shea you have to vote for the one who can win the nomination and that’s bernie berni… 
195,"tv producer: i’ve got people at a bernie rally

network: dear god no

producer: warren she’s doing

net… "
196, warren's intelligence compassion and ability to turn progressive plans into action does see… 
197,hard truth: bernie sanders candidacy is the best hope for the policies that warren supporters want to be able to ov… 
198, __warren possible aggravation of earlier shoulder injury
199,_ how so this is not even the case cuz bernie's policies are to the left of warren's also there's the fa… 
200, sure have a look at past twitter posts of some bernie supporters pl… 
201, if everyone who thinks warren would kick trump's butt and make an excellent president would just vote for… 
202,sen elizabeth warren (dma) is promising to reinstate welfaredependent legal immigration to the united states ta… 
203," then help me decide 
my candidate klobuchar dropped out texas primary is tomorrow i need to decide… "
204,i’m not voting for warren because she’s a woman i’m voting for her because she’s the best candidate with the best… 
205, ms warren if you don’t become president please stay in the senate you are so greaty needed there
206,bloomberg fail massive bernie rallies warren super pacs dnc vs sander via 
207,a vote for warren is a vote for warren not for another candidate & if you want to vote for her but because you thin… 
208, the entire list of candidates took turns bashing bloom hardly was warren herself anyho… 
209," the two wings i see are:
 the practical liberals who know how to get things done biden and warr… "
210,can the us get over the fact that warren is a woman and get behind her how tf are we not sick of old ass white me… 
211, the fact that the only thing that kept them from uniting behind bloomberg was warren shitting… 
212, we've just gone from a crowded field where her signal was being drowned out to a way contest betwee… 
213, trust me no one in their right mind is buying that line of bs
214, not just warren other women have come forward; demeaning and insulting women is something he's been doing a long time
215," 😂🤣😂🤣😂
pete is not progressive warren is only p… "
216, after his interview with warren where he was trying to take bloomberg’s side who allegedly… 
217, i'm voting for warren but she needs a big win on tuesday
218, psst it's cause warren is not a progressive she just did one good thing
219, the reason was not announced maybe it had to do with the blowback from the warren interview
220,bernie: if it's not clear from the above i think bernie has a great vision and message i just dearly wish that hi… 
221,_r_sanders so then can i use that excuse as to why i do not support warren because i'… 
222,this gives me pause ultimately the points i make above win out and it's only fair that warren be able to stay in… 
223,"counter argument: ""if you believe bernie hurt hillary last election could not have that been the tipping point leadi… "
224,drucilla is an actual intellectual warren cynically pretends to be but is not interested in examination or pursui… 
225, literally just saw a thread of people saying how warren wasn’t progressive under a post about how… 
226,in the same way i hope people will see there's a real enthusiasm for an intelligent woman candidate and the things… 
227,in case there’s any confusion a vote for warren is a vote for biden progressives choose wisely
228,"it's stunning to watch unfold

the phrase ""dumbingdown' applies
people can see when it is happening with gop ye… "
229, and i’m a warren supporter but i’m sad that the same group has been in charge for my entire life
230,"rando scholar 

drucilla cornell has a reputation and credibility among academics warren can only dream despite he… "
231, sen warren had a choice to make to start her campaign be her slightly leftofcenter self or… 
232,"""a vote for warren is a vote for (centrist candidate)"" we should be able to vote our heart at some point in this p… "
233,the important thing is to learn and grow that journey should be spotlighted: show continuously that you know you'v… 
234,warren has apologized for wrongly claiming native american ancestry she could do more she knows she was wrong ab… 
235,if she had not said anything on it then she could have been cheered for not taking any pac money and if the circums… 
236,_va_ i respect your choice for a candidate elizabeth warren is definitely a good candidate i dont real… 
237,i’ve totally prepared myself to wake up wednesday morning to an email from warren saying she’s suspending her presi… 
238, riiight apparently you did not read beyond the headline there's no men… 
239,) super pac money folks should be able utilize the rules as they are to best affect their chances to win bernie'… 
240,but let's be fair warren's not perfect here's some thoughts i have about complaints regarding her these have bec… 
241,"if ""she used to be a republican"" turns you off warren i would counter ""who better to try and convert a republican… "
242,i also think that background of growth allows for someone to better speak to people who have might just be starting… 
243,"committed 

welcome to the big shots live slam series:

big shots elite south carolina warren

jason warren team h… "
244," i'm not here to criticize warren but can we please stop using ""old white man"" to describe bernie sand… "
245,/ my experience with the nevada campaign was nothing in comparison to the six woc who left the campaign after bei… 
246,) warren can be flexible and has shown growth and change in the right direction for the majority of her adult life… 
247,warren has no chance 
248,warren can build collations with people who do not agree with her and can create real tangible results one example… 
249, bernie is an ideologuehe has great ideas (livable wage medall higher ed deb… 
250, but biden is not going to drop out and endorse bernie which warren presumably would be do you think amy a… 
251,i cannot wait for the us election to be over so i can back to no one being called warren doing anything of note… 
252,there’s no reason to be voting with anything other than your heart in the primary that’s the point i’ve heard a f… 
253,i truly believe if % of our leaders were women we would have a much different and better nation it's ridiculou… 
254, this was not the first instance of matthews doing this type of thing there were other things a… 
255,) we have inequalities created by disproportions of representation regarding wealth race and gender both warren… 
256," thank you for this super positive totally not toxic post
as a warren supporter this is the kind of movement i could join"
257, the job this year is to beat trump warren had her chance to make her case it's over
258,political thread twitter is worthless for coherent discussions of anything important but i want to share in case i… 
259, warren anyonewarren patriarchy bullshit is what this is
260,in other news i voted early for warren
261, why would you do this such a let down liz warren deserves your backing
262,maybe just my feed but i feel like i’m seeing a lot of convoluted justifications for warren>sanders it’s okay to… 
263, with all due respect no he's not elizabeth warren is
264,hilarious to assume any of those two will beat tr*mp vote warren 
265, warren can not get poc voters still no good argument how she's a stronger candidate than bernie based on that alone
266,chris has badgered women & shown otherwise poor judgement or so i have read sure was hard on elizabeth warren in… 
267,_polling need to delete biden and warren asap
268, elizabeth warren never fails to piss me off she just can’t resist making snarky… 
269,pt bloomberg voters can not seriously think liberals will vote for him too biden can not debate well bernie can bu… 
270, they said the interview with warren asking about her allegations on bloomberg it was sexist then he… 
