,text
545,i believe the strategy of having candidates drop out & support biden will largely backfire the theory that biden g… 
546,why do so many people think voters would go to this is not about progressive or centrist i… 
547,_negro_ if you want to talk by dm i can make the case why warren was part of biden's team all along but i re… 
548,time for warren to drop out & assist dems with a narrower field—vote blue no matter who 
549, __ nobody said to yell at warren supporters showing unity with high profile warren sup… 
550,plz i cant believe i have people on the tl preferring biden over warren or berniecome on 😭
551,literally lmao as in laughing so hard i almost fart imagining what the bernie crowd would say about warren saying t… 
552, _agust more proof that warren is a fake progressive if thats the kind of suppor… 
553, bernie can’t win ec neither can warren biden has a shot
554,if the msnbc talking heads are going to hold this against elizabeth warren rather than being outraged at chris mat… 
555, this is exactly the thing to not be doing vote for the candidate who is the beat vote for warren
556,political leaders in massachusetts campaign for elizabeth warren 
557, this is not what the most recent headtohead polling showed (though things may have changed since bi… 
558,if elizabeth warren has a disappointing showing tomorrow for super tuesday will she drop out before next week's primaries
559, i enjoy your sardonic wit and self deprecation
560,i don’t think i’m gonna know who i’m voting for until i am sitting in the polling booth staring at it for forty min… 
561, _ agreed warren would make mincemeat of trump even more so than bernie trum… 
562, also watch to see whether elizabeth warren accumulates enough delegates to put bernie over the top her price: vp
563, if bernie has % of delegates and warren has %
564,obama endorsed elizabeth warren the dems are pulling out all the weapons
565,josh warren finishes runnerup in a state in the m hurdles setting a new school indoor record running a 
566,@_ashlake_ _bernie so are you gonna blame sanders if he does not… 
567, there’s a lot of it out there here i’ll offer a little help after screaming about… 
568, again i would love to agree totally if i could appoint a president it would be warren s… 
569,the only think i'm gonna say about super tuesday is that biden is who you vote for if you want to pretend that … 
570,_ will it help warren get votes/delegates in california i’d say it’s plausible
571, i like bidenwarren with harris at ag bloombergcommerce steyert energy buttigiegveterans affairs sa… 
572,so biden sanders bloomberg and warren actually say out loud they will raise our taxes a lot just what i always… 
573, vote for elizabeth warren
574, if warren wins happy to back warren it’s always been bernie/warren can we not judge the largest prog… 
575, warren is a flip flopper there is no certainty with her
576, boy msnbc really does not want to acknowledge warren
577,if any warren supporters are reading this i’m not writing these jokes to convince you i know i can’t convince any… 
578, i’m disheartened to see this from you jenny 😞 bernie is willing to provide medicare for all an… 
579, warren is the better candidate i’m voting for her if she ends up not getti… 
580,becoming a leader is synonymous with becoming yourself it is precisely that simple and also that difficult (warren bennis)
581,also: sanders supporters overwhelmingly prefer warren as a second choice and if her campaign got some juice from b… 
582, laughable that warren is still considered progressive
583, i managed to convince one former pete supporter to not switch over to joe now she’s moved over to team w… 
584, among other things senator warren is the youngest and smartest and could blow all the candidates away… 
585,warren’s new slogan is: “not him meeeee” bernie bernie warrenendorsebernie warrentobernie warren
586,when warren drops out sanders supporters are going to have to make the case to warren's supporters that their polic… 
587,love how bernie bros are attacking warren nice
588, we will end up with biden otherwise warren voters are moving to biden bernie… 
589, darya but has not warren said from day one she's just like bernie in terms of progressive… 
590,in coronavirus plan warren focuses on workers rights and protecting the uninsured 
591,biden does not have a shot against bernie and warren is likely gonna drop out as soon as supertuesday is over… 
592, this is so transparent the democratic establishment wants warren to stay in so she splits t… 
593, warren is on the list of supporters of bernie's ma plan the others arent
594," he had invested in 
"
595, the house only impeached trump because the ukraine scandal involved biden if trump h… 
596,_kat and for a cabinet position or something they were deals made it's obvious everyone got something i… 
597,____t that's fine they can vote for someone else if they wish but warren no l… 
598, if warren loses massachusetts to sanders tomorrow will you back him
599, elizabeth warren is not singlehandedly responsible for turning the tide against chris matthews—he made a… 
600, nope sorry i’m staying with warren bernie supporters have done nothing the last few months but… 
601,@_reaalamerican_ _klaus warren is the choice for prog… 
602, i’m all in for warren after that it’s biden bernie is for twitter warren is for actually getting things done
603," warren
she does her homework"
604, is part of supporting warren also lying about her qualifications are y'all emulating her or does it j… 
605, as i said before either case i don’t see a warren presidency either case all i want is find the path… 
606,warren is radical yet rational and bringing people together that is what we need not somebody who may collapse an… 
607, warren is not a progressive 
608,but you know elizabeth warren is shrill and challenged bernie and eventually caved on superpac money after a year… 
609,watching bernie supporters asking for warren to step down cause their confidence is starting to fold 
610, no i'm all for bernie though i like warren too let's chalk u… 
611," absolutely they both need to be int he race people are stupid to make her leave the race

in a race wi… "
612,if warren is a spoiler for him then that makes him a spoiler for tulsi 
613,_dockery i believe elizabeth warren would make a much better president than either one and they’re very clos… 
614,if she's not gonna endorse bernie i wish warren would at least have to decency to run on the honest truth that her… 
615, this is revealing—i can not imagine almost anyone outside of academia arguing that sanders should drop out… 
616,_joe so sad it's interesting guys like charlie munger aka warren buffet right hand man was so… 
617, exactly i’m a democrat i want a democrat to win i was for harris democrat … 
618, honestly; warren needs a good stylist
619,officially muting anyone posting about how elizabeth warren is practically perfect in every way she isn’t no cand… 
620,"like warren i had my own sexist runin with chris matthews | gq 
this article made me “woke” it wasn’t just a one… "
621, what i don’t understand is the desperation so many “warren should drop out and endorse bernie” hot takes a… 
622,warren has delegates to bernie's (the most of any candidate) and bernie should drop out is there something i'… 
623,i have lost every shred of respect i once had for elizabeth warren
624, this would make sense of course if warren were getting better traction but she is not… 
625, i was a pete supporter and i would actually go to warren
626, this is probably the best endorsement anyone will receive today warren gets shit accomplished
627,"special thank you to dan altavilla ( ) of the seattle mariners
for setting up this photo with taylor g… "
628,/ warren’s team is simply not capable it’s why she only has delegates it’s why her numbers are declining… 
629," lots of noise on who gets a bump

sanders should benefit the most since he's pete warren & biden su… "
630, yeah really you want the dnc to pick for us 
631, i agree with everything you said and yes warren rocks
632, warren is the only one who can help let's see if her ego will get in the way of that
633, biden bows out throws support to warren who is in delegates the progressives are happy women are h… 
634,how did i just listen to a whole radio segment on super tuesday just now and the panelists did not mention warren o… 
635,like warren i had my own sexist runin with chris matthews 
636, i can not wait until we swear joe biden in january i'm hoping his admin will consists of harris butt… 
637, what is this a game to you i’ve been extremely let down by warren and interactions with many of her… 
638,you're a sexist if you ask warren to drop out but making fun of a woman of color literally in the next tweet who is… 
639,_j_beans right wild to me how warren is simultaneously criticized for being too avoida… 
640,i am primed to go out on the streets if mainstream dems fuck over bernie if you’re still voting for warren you’re… 
641," can we keep the warren v bernie arguments off insurgent dem candidates posts 
if they’ve made go… "
642, we will know early if sanders has picked off enough warren voters to win if he wins mass going aw… 
643,man mansplaining sexism to women who don’t want to vote for warren becoz policy is peak mansplaining 
644,how stupid are people a vote for warren isn’t a vote for trump there is zero comparison here 
645, warren has promised you vp self interest much
646, this feminist will never support elizabeth warren who doesn’t seem to understand the differ… 
647," you are nothing but a warren shill 
don’t call yourself a journalist 
hopefully mathews will head to h… "
648," / i do not see this as ""unity"" this is a ""get rid or bernie at all costs"" no one i… "
649, yes that’s a fear 😔 warren 
650, haven’t been one long and bernie and warren are the only to have texted me multiple times
651, i understand i'm mostly disappointed because i think she's brilliant and i think you're… 
652,more on chris matthews: he faced mounting criticism over a series of recent gaffes incl a comparison of bernie sa… 
653, i do not know about this logic i do not see what warren would have to negotiate with sande… 
654,you know what vote for elizabeth warren and stop playing in their pissing contest 
655, not only did i vote for warren i took my grandmother today to a library polling station after she co… 
656,breaking: elizabeth warren is ending her presidential campaign according to multiple media reports
657, you lost me with that last line but i'll be pulling for bernie… 
658, i kinda wonder if warren is waiting until the convention hoping she’ll have more delegates for bernie w… 
659, if you care about the issues that warren talks about you have to s… 
660,each day that goes by i am convinced that warren is staying in the race in order to prevent a sanders victory 
661, i’m not negging warren voters to to sway bernies vote unlike amy and pete’s backers did i’m saying… 
662,elizabeth warren listens to americans that others ignore she gets our vote | opinion 
663, in fairness to tucker he has some independence from the conservative orthodoxy (or even the trump ort… 
664, we could just as easily say that bernie would roll away with this thing if warren drops o… 
665,if ms warren doesn’t endorse bernie she’s a meat clown 
666, _moviebob warren (fucking evidently if the polls are any indication) lost credibility with the am… 
667, warren has trashed bernie multiple times do you expect us just to sit down and take the abuse
668, warren is there as blocker she’s definitely on team dnc
669,"all these warrenendorsebernie warrentobernie and choosewarren hashtags twitter getting a little rowdy 

i alwa… "
670,i support warren because of her statesmanship if the time comes and my vote needs to go to another i hope she ga… 
671," that’s what i’m saying
warren may be staying in it to keep siphoning dele… "
672, there's room in the us for bernie's passion warren's plans biden's compro… 
673, it’s way too early to say no path to victory and i think a lot of warren fans myself in… 
674, warren staying in the race to maliciously thwart the progressive movement isn’t good for us… 
675, neither warren or bernie are gonna make it unless one of them has enough to secure the nomination on th… 
676, personally i'd be more than willing to vote for warren here (fl) if she was closer to the thresho… 
677, i understand you feel that way elizabeth warren doesn’t i’m not hanging around the senat… 
678, the offensive part is where you imply warren supporters are stupid “you don’t even realize… 
679,"not surprised i said berners would hit warren supporters hard to get out asap

do not fall for their guilt trips… "
680, as someone who was a big warren supporter early on vote bernie we need to stop the centrists by co… 
681, he literally cited his comments about women as the reason for his resignation th… 
682,"i just looked through bernie's warren's & trump's shops here is what i found 

bernie has the most ballsy merch… "
683, i do not think warren's campaign did sufficient outreach to poc sanders' campaign learned… 
684,"wearing my warren tribute tshirt on my birthday i’m excited to choosewarren tomorrow 

warren… "
685, and the smartest electoral strategy would be to vote for warren get behind warre… 
686,so democrats obviously are also party over people if you made a warren/sanders ticket then that would be the best… 
687, ah let me make this clear for you my dude there is nothing nothing stopping bernie from getting… 
688, warren seems to be the smartest by far most importantly her background has imbued her with knowledge of w… 
689, that's sanders dr reich after warren has aquiesced to the incrementalist elites and her flip flop on pa… 
690, any clue if it is feasible absolute want warren to win if not the case we are sce… 
691, if you'd actually do a little research you'd find the information on how sanders and warre… 
692, if your criticism of sanders is true knowing for a fact you have very little to no black vote why aren’t… 
693,a vote for elizabeth warren is a vote for joe biden full stop
694, nope sorry i’m staying with warren bernie supporters have done nothing the last few month… 
695, i love warren and while i’d be thrilled with biden i’m still go liz
696, this primary has been eyeopening watching msnbc i didn’t notice when it was the mueller/russia… 
697, this gives me movie sonic flashbacks (old design concept)
698, sanders was ready to step aside for warren in she chose to get behind clinton instead this is… 
699,_writes warren also lost favor with me when she abandoned ma and started accepting superpac money which s… 
700, chris badgered warren abt her attacks on bloomberg he spoke a reporter abt her looks & makeup been do… 
701, it's wild that they just moved most of the bullet points of hillary support on to warren
702,_netizen worst part warren does not mean a thing she says she is % pandering for votes
703, it seems like something was coming aside from all the recent criticism re: sanders and warren
704,terrific night in the warren science & technology building the first technology industry night wa… 
705, i would not worry about bernie or warren corporate america is not about to elect a socialist or a woman … 
706,if we stick with in two weeks there will be another debate likely with only warren biden and sanders… 
707,i swear to god if the places were swapped at this point in the game and warren was the front runner i’d be begging bernie to drop
708,if bernie supporters just voted for warren then we'd have medicare for all bernie is just propping up biden now t… 
709,the same people who were shouting for months that warren and her followers aren’t *real* progressives are now shout… 
710, suggesting warren should drop out (rather than continue her official campaign strategy of stealing n… 
711,bernie is too far left and joe is too status quo warren is the best choice she smarter and has the best platform… 
712, this is the question right here warren is great but we have to be realistic bernie will rally young… 
713, i appreciate that warren has experienced sexism just like harris and clinton did but that did not influence my vote
714, elizabethwarren couldn’t take remarks from chris matthews you are to blame warren you & bernie are soci… 
715, if you think warren is the better candidate vote for her don’t let others convince you who is or isn’t viable
716,"women’s group demands msnbc fire chris matthews over elizabeth warren confrontation

and bloomberg faces cas… "
717, fair but warren could earn some leverage we will see how this plays out
718," why do you split donations between warren and your organization

you shou… "
719,i supported warren the last years and donated to her multiple times over the last year i don’t care about her at… 
720, some of warren's effectiveness in the democratic debates is not translatable to a general election debat… 
721, if biden and sanders are the only two to reach % then they… 
722, _barry _warren thank you coach p wouldn’t be here without you
723, wendythere are good and bad people everywhere… 
724, does not matter if warren is taking delegates that bernie could be winning in a dwindling field of candidates
725,q: for all the warren supporters out there how would you feel if warren decided to drop o… 
726, still warren followed by biden
727,"this is why chris matthews has been fired from msnbc 👇

like warren i had my own sexist runin with chris matthew… "
728,your vote for warren really matters (gotv) 
729,_x i voted for warren at early vote in appreciation for her hardwork in lieu of elizabeth i am all in for… 
730, warren and harris have been friends for years going back to when kamala harris was an ag th… 
731,that's a hell of a way to go out too bad he did not earn it and his performance in last tuesday's interview with w… 
732,warren now that everyone's telling her to endorse bernie 
733,and people wonder if liz warren can get things done 
734,"i’ll tell you what: i’ll agree that warren is a spoiler and should drop out because she hurts bernie’s chances

if… "
735, and dude if you think my initial rant was *about you* please please please take a moment to think abou… 
736, sorry to say a lot of warren supporters are not actually progressives/ % struggling hu… 
737, listen mehndi hasan is already a corporate ghoul with his warren support
738, i’d vote for a feral cat before us vote for trump i love warren i think of all the ca… 
739,"foil hat on:
the dnc is keeping warren in the race to pair later with biden so they can give each other their deleg… "
740,"_star_gem i'm with warren then biden
bernie bros made me hate him"
741, the one to watch is warren will she swing bernie’s way or not smart would be for her to throw in with steyer
742,__vult_ march    “darkness to light: new age counterfeits and catholic truths” with warren vale herman
743, native nations (a demographic facing disproportionate poverty in relation to their whi… 
744,hardball is still trash is still erasing warren 🤬
745, i believe it’s time we have a woman president bernie & warren have similar policies but her plan… 
746,cult of personality i have not seen any bernie supporter so far who'd be completely uncritical of him if it were r… 
747, _reply_guy _yenta have you not paid attention to the people warren h… 
748,__terra uh no one on the set knew what he was going to do walk off the set
749, more importantly people dropped out after % of votes were cast in early primary statesthis shit n… 
750, a vote for warren at this point is basically a vote for biden
751,"he makes excellent points it is too early to vote strategically 
"
752, i wonder if warren staying in the race and dealing with sanders in a convention (by aligning with each… 
753, there is a legal argument that you could remove it via exec order it's not a slam dunk but it… 
754,"_k joe is the youngest at just the ""b"" guys left i liked other ""b"" guys booker beto and butti… "
755,/ not supporting warren because of failed leadership a horrible electioneering game and a literal waste of oppor… 
756,⁦⁩ believes in a market economy she just wants it to work for everyone writes 
757,_warren but biden loves china
758,warren supporters are so desperate it's actually hilarious
759, although warren gave him a good right hook i think the final straw was a scathing piece by… 
760,"warren has a coronavirus plan but it's not part of her presidential agenda

it's what she wants the federal govern… "
761,"my mom in : i like clinton but i just don’t know that other countries will respect a woman

my mom in : i… "
762, smarter narrator: trump has more minority support than warren
763, i'll vote for him if i have to but i'm going to hang in there and see if war… 
764," tru but they said ""stop eliminating the woman"" and only mentioned warren"
765, also at that point it was down to bernie and hillary… 
766,warren drop out 
767, he is not it's all an act senate hearings will be happening biden i hope to god drops out before the… 
768, when you're on the edge of another years of a president that will do little to erode the growing w… 
769,the thing is committing delegates to bernie would give folks more reason to vote for biden instead of warren 
770,"bernie sanders and nina turner

or 

elizabeth warren and andrew gillum "
771, this is fair i dont think most warren voters still around are progressives most i know who have legit… 
772, this shit makes warren supporters like me want to turn to biden instead of bernie
773, i'll give that was rough for her she was caught between two friends hill… 
774,_ander biden is literally now promising to fix the problem he made that made professor warren so angr… 
775, warren gets things done
776, i'm curious to know why sanders and not warren she's a progressive without the baggage s… 
777, i think it was his interview with elizabeth warren after the nevada debate where sh… 
778,warren’s political ambitions are overshe will always be remembered as the spoiler her egotistical stance to conti… 
779,": nobody is owed anybody’s vote if you can’t convince me to vote for you that’s on you 

: ok we’ve had… "
780,if pete buttigieg and amy klobuchar endorse elizabeth warren before super tuesday then most likely pete buttigieg… 
781,the people unfollowing me for supporting sanders are not my friends & never were to begin with i see you i liked w… 
782, also: it's not clear that warren dropping out will help bernie
783,ok y'all can we just end this whole primary thing now just launch biden and bloomberg into the sun have warren a… 
784, if bernie sanders endorse elizabeth warren before super tuesdaythen aoc will be the vice presidential candidate
785,"democrats are going to try an coalesce their moderate base around biden 

either bernie or warren is gonna have to… "
786, bernie needs delegates to win biden needs … 
787,"i got people from texas to commit in an hour ~southern hospitality~ 

“fuck yah i am ready for warren”"
788, so warren is apologizing for what then 
789, tisya i'm really feeling for u right now but through this whole thing you've been sticking to what… 
790,elizabeth warren is and has always been both a class enemy and a white supremacist in that way she is indeed intersectional
791, ok thank you i will finish reading it later i'm not… 
792,__ not sure why you're quote tweeting me to your much wider twitter followers i never said her support… 
793, this has nothing to do with warren or who i'll end up supporting but the threats of nonvoting or… 
794," it took pressuring warren to get fired
god this country sucks"
795,if i have to read one more bernie supporter bang on warren about what she should do for them i may lose my mind… 
796,"berners in : hillary needs to earn my vote

berners in march : ignore the fact we called pete supporters… "
797,_acumen elizabeth warren will be the third candidate that will stay in the race that way the superdelegates… 
798, a vote for warren is a vote for biden
799,huge shout out to elizabeth warren and laura bassett
800,[trump voice] elizabeth warren pocahontas she’s got a plan to annihilate all bussy so bad can’t happen
801, not to mention we have to deal with shitty warren stan tweets like this one
802,every warren supporter so far has told me they will support bernie in the general 😎
803, shelly that is actually untrue sanders has actually passed more legislation than any o… 
804,warren backed off ma and not taking super pac moneyhow is she for real change genuinely asking 
805, if you think me telling you the fact warren cannot ea… 
806,i mean i see why the moderates are doing this but why not rally around warren i do not get it the bernie hate… 
807, i have a theory if you base it off of the idea grassroots donations = votes she wins second… 
808,a vote for warren at this point is a vote for the establishment 🤷‍♂️
809,__warren they need every point they can get you dont just sit one of your stars for fun something is bother… 
810,even as many in the pundit class determine that warren must be auditioning to play nd fiddle to the senator from v… 
811,_katyal sure she repeated the same me me me story about her life like it was chiseled in her brain and it be… 
812,any chance warren can shock the world tomorrow i'd like to see it but again and always: votebluenomatterwho 
