,text
1906,i like when ppl call elizabeth warren “liz” like they know her baby she doesnt give a fuck abt any of us ❤️
1907,i am angry with you for trying to push warren out because it’s misogynist as fuck i am dismayed at you dismissing… 
1908,_clarkjohnson i mean i agree and nuclear power is my number one issue which is why i support warren first
1909,imagine warren vs trump on the debate stage choosewarren 
1910, i voted warren
1911," would you be good with a brokered convention resulting in warren

because i would"
1912, i do think that warren wanting to go to a broken convention for a second ballot is not a good strategy
1913, warren’s campaign is the main one to be shown to have a cashflow issue (which was rectified in feb t… 
1914,steyer dropping out of the race was a counter punch that bernie definitely needed prior to super tuesday after the… 
1915, his onair fight with elizabeth warren about why we should believe the woman who said b… 
1916,warren really destroying creepy old men left and right solely by showing that they can’t intimidate her love that
1917,many people do not show mercy because they do not understand the difference between trust and forgiveness forgivenes… 
1918, you should be ashamed of yourself for not endorsing warren you talked so much women p… 
1919,look at this point idc if it’s warren or sanders i love them both but one of y’all needs to drop and back the other… 
1920,the old guy with the heart attack is winning why isn’t warren winning 
1921, i get it electability is an ephemeral thing but it’s a thing for me this is also a “moral referend… 
1922, only candidate wants to abolish iceit’s not warren
1923, no no any and all disagreement constitute an attack and slam a… 
1924, that's fine i like warren
1925,if you let idiots off the hook for voting jill stein in let some of us vote for elizabeth warren
1926, warren was my top choice at the start of the primary i hate that bernie and warren supporters have b… 
1927,yo i disagree with elizabeth warren taking money from super pacs block me you coward
1928,klobuchar's supporters report second choice as % warren and % biden but also % buttigieg so who knows what th… 
1929,"_in_nc i’m a warren voter 
my vote would have gone to klobuchar but now would go to biden since she dropped out"
1930, very true but priority is beating trump at this point unfortunately… 
1931," first mayor bootyjudge dropping out unexpectedly and now chris ""commies are not good"" matthews resigns… "
1932, also would have cleaned ’s clock in debate i… 
1933,warren accepting superpac money to stay in the race despite not being viable apparently solely to torpedo bernie’… 
1934, warren is predicted to not even win her own state and she may not win any delegates for t… 
1935,"good riddance to chrismatthews

now maybe will give the time slot to or 

"
1936," it's now biden sanders and warren
remember bloomsberg said he'd help the democratic nominee if he lo… "
1937, i’m alarmed to see this you don’t even live in a super tuesday state warren is the bett… 
1938, bernie became a millionaire from workin… 
1939,warren abandoned her few progressive policies she does not support ma and i do not believe she supports tuition fre… 
1940,warren airing ads making it look like obama endorsed her in cali right before supertuesday
1941,elizabeth warren is the most effective leader out of the remaining candidates and is the most progressive candidate… 
1942,cool vote warren 
1943,"warren must drop out now she is in no position to get the nomination but will only hurt bernie in the process
sh… "
1944, berners were saying he stayed in to get concessions on the platform; why shouldn’t warren do the s… 
1945,"thank fucking god

and elizabeth warren "
1946, warren's just dragging the prog movement down with her failures
1947, bloomberg sanders warren & biden are antisecond amendment there's o… 
1948, unfortunately it makes it more likely buttigieg and kloub's voters second choice is biden so he'l… 
1949,really appreciated courageous piece last week about chris matthews in … 
1950, turns out my precinct went to bernie over pete by two votes (literally my wife and me) had i voted for… 
1951, i like warren a lot but right now progressive policies are about uniting a movement and i think… 
1952,_gryphon something tells me this'll be short lived but hey let's what happens
1953, love the latinx leads but warren is toast she's the same platform as bernie and he is going to win cal… 
1954,_view do you actually see a chance for warren to accomplish anything more than drai… 
1955, yep this will persuade warren supporters to vote for bernie
1956,"hey worcpoli folks i am looking for some candidate campaign watch parties in worcester on super tuesday 

so far… "
1957, i love elizabeth warren i always have
1958, warren then biden
1959," he's and warren would compromise her position to ""get things done"""
1960, _bones exactly even though bernie and warren are so similar on the issues i d… 
1961, bernie would step down to get people healthcare i support bernie and would have no pr… 
1962, literally the reason she came out is because she felt he was too mean to elizabeth warren i'm not… 
1963, anecdotally: several ca friends who were leaning warren or buttigieg are now voting biden
1964,pretty sure the warren ad i just saw on youtube uses the theme from boston legal which is honestly the perfect targ… 
1965, i also sent in my vote for warren i love mailin voting
1966,"people: i really like elizabeth warren but i don’t think she can win
me: she will if you vote for her presidentwarren"
1967, warren can stay in as long… 
1968,in coronavirus plan warren focuses on workers rights and protecting the uninsured 
1969, i am still voting warren but conceded long ago she's done
1970,thank you to elizabeth warren for getting chris matthews fired during that commercial break somehow also pretty ba… 
1971, hope u give biden a look if warren ever drops out and i will def vote warren if hoe drops out
1972,it is weird and revealing how all the credit is being claimed by warren stans for chris matthews' ongoing public me… 
1973, it should be between warren and biden i want bernie to away he should never have gotten in he is not a democrat
1974, but if warren stays in the race it might actually be good for bernie
1975,if bernie isn’t the nominee trumps gonna win nobody outside of the win caves and the “vote blue nomatter who”… 
1976," 
warren for potus "
1977, if you are a warren woman by heart this is disappointing % delegates t… 
1978,the truth is that warren's candidacy and warren's presidency are as decoupled as one's marriage from one's wedding
1979, san antonio’s own will tell you that we can win with warren
1980,bruh why’s warren always talking about “ years ago” bitch yrs ago u were a republican masquerading around as a… 
1981,as opposed to trumps’ free stuff for billionaires please 🙄🤔 wise up usa there’s plenty of free stuff going aroun… 
1982," _plain i do like the spot in the article discussing warren's ""credible story of pregnancy… "
1983, still haven’t quite decided between warren and sanders though i’m generally ok with either
1984, voted warrenhoping for more change than back to status quo
1985, you realize mathematically the race is between s… 
1986, bernie was my choice but his only bernie supporters are psychotic i am in the… 
1987,"there is a rd choice between sanders to the far left + biden to the moderate center

elizabeth warren possesses a… "
1988,fuck warren 
1989,@__krisssyy what's keeping warren burnie is gonna do a repeat of '
1990," so why does she support doing away with the filibuster and bernie does not

while we're at i… "
1991,_wiener _for_warren after all this resistance and attempted coups w… 
1992,before supertuesday tomorrow check out the delegate count in the race so far: … 
1993," this is such a great point 

ties in with warren buffett’s quote that he plans to leave… "
1994,thread warren is my preferred candidate and we do her no favors by demanding voters esp cherokee & other native/i… 
1995,_asian you know who i trust to put some teeth into the nlrb the ones that reaga… 
1996, there were a couple of sexual harassment (not matt lauer level just clueless stu… 
1997, the best person to beat trump then actually get sh*t done is warren which is what pu… 
1998,warrenendorsebernie she will not warren passes as a progressive in the same way that she tried to pass as a member o… 
1999,when many of us say that we are disturbed about the harm elizabeth warren has caused cherokee & indigenous people… 
2000, i have not seen the level of detailed plans from bern… 
2001,"my first choice is warren

my second choice is a contested convention with plenty of blood and teeth on the floor "
2002,_belitsky she won’t she will do what she did to hillary anyway warren… 
2003,chris matthews is retiring and mike bloomberg is no longer ascendant america owes elizabeth warren a damn debt of… 
2004,this seems like a fair point if warren sticks it out she could roll up more delegates and throw them to sanders at… 
2005, why should we back warren is it her inability to stick to anything she… 
2006, but that's not what he did i am not a smug banshee i do not shriek in his mentions but he… 
2007,hope bernie people using the buildtogether hashtag see that warren surrogates are still actively trying to harm be… 
2008, no she can win if we vote for her his policies are based on her research… 
2009," literally just had a friend ask me ""why warren over sanders"" and when i explained my reasons (more quali… "
2010,protecting you from shenanigans since day one warren 
2011,technically chris matthews ended his own career warren just stepped aside like the road runner as he wile e coyote… 
2012,imagining a future dem debate there stands joe bloomberg and bernie next to liz warren i see myself wincing lau… 
2013,blows my mind that people on this app really believe warren still has a chance
2014,this might be the alpha brain talking but what if the dnc convinced pete and klobachar to drop before super tuesday… 
2015,warren in cahoots with the dnc you're joking right dnc is a nightmare and probably biden all the way is the onl… 
2016,_vids among other things warren is a victim of sunk cost fallacy
2017,__morris warren will be done wednesday 😂
2018,biden lies about shit (nelson mandela) or can not even remember things correctly and warren tried to claim she was na… 
2019," warren = bernie delegate lead winning popular votes working class coalition

check your work next time"
2020,the more people that vote for warren the more delegates she gets so vote warren 
2021, i voted for warren as she’s my senator and i believe in her but i feel that joe is my guy… 
2022, he's had bad couple of weeks his postdebate rampages poor treatment of warren bernie comments and a… 
2023,the democratic establishment is mobilizing to stop bernie sanders rolling stone 
2024,something that's bothering me i'm seeing lots of people buy into the sanders v biden narrative if you're saying w… 
2025,"which is one of my big problems with the ""warren drop out"" from the bernie stans who think they deserve her votes… "
2026,biden / warren and then warren / castro in is a monster move for both this cycle and for ruling the decade a… 
2027, it seemed fairly obvious that warren is aiming for the vp nod from bernie at that last debate other… 
2028, robert the party is corrupt look wht they did in iowa warren is aligned w the establishment and that's t… 
2029, only % of delegates are committed it’s far from over if you support warren vote for her
2030,not followed the us elections apart from tweets on my timeline trump vs bloomberg would be interesting they’re … 
2031,"vote elizabethwarren election 

supertuesday 

warren campaign makes case for path to nomination axios "
2032, warren elizabeth warren has a plan and the budget figured out for the promises s… 
2033, klobuchar out buttigieg out i think biden was supposed to but he forgot warren is… 
2034,like warren i had my own sexist runin with chris matthews 
2035, watching warren refuse to unite with the progressive party has been tragic and reminded me of a specific s… 
2036,there's a lot of compelling arguments on both sides about whether warren should stay in the fight or drop out of th… 
2037, replace the words elizabeth warren with bernie sanders and your point is just as relevant… 
2038, elizabeth warren took him down👏🏼👏🏼👏🏼
2039,"_ president biden 
vp m obama
ag harris 
defense secretary buttigieg 
secretary of state schiff
treasury warren"
2040,i voted for warren i also really like bernie and keep wavering between the two but my support for bernie is not b… 
2041,warren hasn’t won a single state she’s in danger in ma 
2042, unfortunately the two front runners right now are (no surprise) two old white men but i really truly th… 
2043,here's liz warren aghast at matthews' onair claim last week that bloomberg would not have any reason to lie about h… 
2044,like warren i had my own sexist runin with chris matthews via 
2045,i know i have some warren friends on here so i just want to take a moment and beg you all to vote for bernie instea… 
2046,“both biden and warren” holy fuck bernie sanders is going to win 
2047,chris mathews dropped out before tulsi or warren respect bro but it’s probably because a bunch of sexual accusati… 
2048,so you should feel 💯💯💯 voting warren do not ler bernie's kids tell you otherwise choosewarren
2049, i have zero doubt sanders and his family will fa… 
2050, i am not getting into a bitch match over this the race is early warren should stay in it… 
2051, of course lots of warren allies might wonder where statements like this were as sanders st… 
2052,secondly look at that data in the four swing states bernie is neck to neck with warren in ohio wisconsin and mic… 
2053,warren for terms 
2054, hard to overstate how much warren would benefit from a sanders endorsement right now
2055,_va_ _agust no vote for warren she can still win only states have voted they want you to think she can not
2056, how biden got back in the race with one state vote for elizabeth warren if y… 
2057, she does not have the votes she has… 
2058, anyone that rigid is not willing to learn (republ… 
2059, it's bernie a vote for warren is a vote for a brokered convention unfortunately a brokered conventi… 
2060, i genuinely believe that if there is a way race at the convention with no major… 
2061,it’s not too late via 
2062, deception is never a good look and the this am calling for warren to endorse bernie gave false imp… 
2063, warren is my favorite but i've decided to go with biden at least he's gained so… 
2064, all more evidence that warren supporters only support her for so they can feel more comfortable with t… 
2065,the rat and elizabeth warren go down within hours blessed day
2066, actually warren is fdr and eleanor all rolled into one great package
2067,"so this is terrifying


the party will not have a united front if there is a contested conv… "
2068,why no on warren: 
2069," sorry not so sure about that

especially since mehdi has kept on bemoan… "
2070, … 
2071,warren should stay in the race if for no other reason that there is at least a % chance of one of the lates age… 
2072, never got accolades from media for anything amy got delegates and media pumped… 
2073," yes warren is captain of the debate team 

she has an answer plan and rebuttal for…… "
2074,"go ahead go from warren to biden give up on all the ""tax the rich"" and providing universal healthcare because you… "
2075,if the situation were flipped and warren was the leading frontrunner while bernie had placed in rd place or lower… 
2076,"…fucking rhetoric on warren supporters the fuck

if people just gave up on the candidate they preferred to… "
2077,i really wish trump never mentioned warren faking her race because now when you bring it up as a perfectly valid co… 
2078," so would warren ;) and she's not same old song and dance old white guy centrist 

vote warren"
2079, _klaus warren woman
2080, in order to reform the system you need the help of the house and the senate unfortunately regardless of… 
2081, i worked with chris for years he’s good guy definitely old school philly which i guess is unacceptable… 
2082, the only way warren has a chance is as a part of bernie's cabinet at this point
2083, i think the recent news that he said things to a female guest that made her uncomfortable she said i… 
2084, she's got a record of being a complete phony who fought against a progressive… 
2085,if you think elizabeth warren should be the president then vote for elizabeth warren on super tuesday do not fall… 
2086,the muslims with warren thread is genuinely some of the nastiest shit ive ever seen yall r stupid
2087, he annoyed elizabeth warren that's why
2088,"prediction:

within coming days bernie sanders mike bloomberg joe biden and elizabeth warren will all drop out… "
2089, i respect your warren but putting bernie and bloomberg in the same bucket is a low blow
2090,_milano what is wrong with you you actually believe joe biden would be a good president i though… 
2091, they are gonna go scorched earth whoever the dem nominee is but sanders has a problematic history &… 
2092, come back when warren wins a single state
2093,in all seriousness a large portion of my social network has come out as warren backers in the last month and it's… 
2094,i had to stop at an airport bar and have a drink because honest to god if i have to vote for biden i will take to d… 
2095, why do people keep wanting warren to do something violent is this the mama bear part of the mother fan… 
2096,warren strikes again 
2097, i so completely understand the stakes i love the passion but sometimes we need to assess w… 
2098, biden/bloomberg/warren will lose to trump voting for them is a good way to give… 
2099, bullshit warren is better than both of them combined this is sexist nonsense warren
2100,warren and bernie taking shots at each other feels like if my nana and pop were fighting i hate it i need them… 
2101, warren hasn’t even come in rd place anywhere how… 
2102, i appreciate you having a civil discussion about this with me i will respectfully disagree that the plans… 
2103,yes elizabeth warren is the one👇🏾 
2104, bernie sucks but how folks could choose warren—who is a wannabe far more deceitfu… 
2105, yep that latecampaign scorched earth campaign really frustrated me still d… 
2106, assuming i support warren 🙄🙄
2107, so fo a segment as a former warren supporter on exactly why she should drop out and endorse bernie… 
2108, of bud you guys didn’t win iowa idk why you bernie fans keep saying you won iowa when you didn’t ge… 
2109, i can empathize and would probably even agree with this attitude if it were a matter of warren vs biden or… 
2110," _smith buttigieg: city council
warren: school district board member (short lived)
klobuchar: sen… "
2111," it's still wide open to win a majority of pledged delegates:

bernie sanders needs 
joe biden ne… "
2112, warren has helped the working class more while someone else was busy renaming post offices 😂
2113,politics dream team if elizabeth warren decides she can not keep going to the convention would be a sanderswarre… 
2114,"laurabassett: like warren i had my own sexist runin with chrismatthews hardball gq 

"
2115, this is insane warren does not have a path to victory it's l… 
2116, if there is any receptor for shame in the body of a warren voter it must be utterly b… 
2117,bitches will talk about how elizabeth warren is younger than bernie meanwhile she looks like this —> 👵
2118, love but we need to defeat trump it is not about who your favourite candidate is biden is unifying other dems
2119,i plan to attend warren for president’s event “detroit event with elizabeth warren” – sign up now to join me… 
2120,yep that's why i'm with warren 
2121,first she destroyed bloomberg and then she ended chris matthews and she's not even president yet warren… 
2122, i remember months ago a lot of warren supporters were saying… 
2123, nooo vote for who you really want don’t give up after just a few states voted give warren a chance she’s an awesome fighter
2124, bruh im a warren supporter
2125, can warren even 'give her delegates' to sanders 
2126, warren has always talked out of both sides of her mouth i have never been a fan especially after her… 
2127, warren yeah shes definitely playing for the establishment now h… 
2128, i was on the fence between warren and bernie even the night before voting in the nh primary but i ended… 
2129,february th warren buffett berkshire hathaway ceo talked about his personal experience in business and g… 
2130,or % of warren’s plan 
2131, _chicken sanders of course he’s the one with warren who have a really new vision and it isn’t a swamp
2132, and i'd do the same for warren or biden but hoarse's original point does not make any sense
2133, democrats on the environment: how sanders warren biden and bloomberg stack up: newsmic… 
2134, i like duckworth (i also like warren booker sanders harris klobuchar etc) but i want… 
2135,so the moderates got behind biden meanwhile a massive secret super pac is fueling warren v sanders where do voter… 
2136, warren should probably drop out
2137,for years i was a fan of since with him say trump against “stupid wars” & his… 
2138,yes she has some progressive stances no she is not more progressive in literally any area than sanders yes sander… 
2139,warren will drop out when the establishment tells her to 
2140, i would love to see a sanders warren ticket they would destroy trump at the polls
2141, i'm pretty stunned you are making a lastminute choice and i encourage you to l… 
2142, i love warren but i just don’t think she can win i wish she could but i think sadly this country is not… 
2143,please unite the progressive movement we must stand together to stand a chance of winning the nomination and the w… 
2144, warren should drop out for the future of the country and the world so that people in this country can… 
2145,warren supporters who are publicly announcing that they are voting for bernie hot
2146,_teets warren in bernie with followers and beholden to her super pac
2147,the planet is dying because of climate change people are fucked because they lack healthcare (in times of corona)… 
2148, that’s the only thing you all can say about mr sanders that he was with mlk what ha… 
2149, yes and maybe warren too although i'd never recommend her for mayor and biden in congre… 
2150,please show me elizabeth warren’s internal polling numbers maybe there’s a path to victory for her that we don’t see
2151, _ho … 
2152,"_ocean what's the plan to pay for all the ""free"" stuff been waiting for this and still no answer i'm no… "
2153, not struggling at all wanted warren but will vote for biden because moderates a… 
2154, i’m just saying people are so focused on bernie supporters sending tweets when they should be focus… 
2155, i think you should take a serious look at elizabeth warren the race is still re… 
2156, your experience likely doesn’t represent even % of what warren voters are likely to do in such a case
2157,hey we do not have to have an old white man as our president we could have someone that's smart experienced and… 
2158," do not listen to ""them"" if you like warren most vote for her"
2159, yupyour metoo movement has gone too far where were you when warren complained about… 
2160, most of the delegates are still up for grabs warren is in it to win it… 
2161,_pmc warren is untrustworthy
2162, the down ballot thing worries me taking senate a must if anything to get done i'll vote for bernie but… 
2163,hello yes i would like to use my celebrity and fame to endorse elizabeth warren for president and to remind everyo… 
2164,i will vote blue no matter who but hoping warren has a great day tomorrow
2165,yea biden there is no one better then for any of the positions in our but i'd esp… 
2166," warren's plan gets those people more help more quickly

can a sick year old wait years for the… "
2167,in case it was not clear why people are getting pretty worked up about warren staying in the race 
2168,"the very old male candidates do not want a debate against warren with this smaller field 

the men don’t want that… "
2169, i know about the warren thing i just mean he must of had an argument with execs to qu… 
2170, warren all the way biden was back in with state she has bvm and m our lives endorsing her and a fe… 
2171,sorry mr reich it’s only bernie otherwise it’s trump again biden is a boob warren is a backstabbing snake… 
2172, so i just read i’m not saying he was right or wrong but according to that article women didn’t li… 
2173, i do not think liz warren had anything to do with it nor the bernie bros who think they have… 
2174,honestly if the roles were reversed i would fully expect bernie to drop for warren i don’t know what she’s doing… 
2175, i think if biden wins the nomination it would be wise to pick a women for vp but not warren
2176,_stl he's been an apologist for sanders for a long time and a vote for warren is a vote for bernie
2177,so two candidates staring dismal failure on super tuesday quit to endorse biden at the last minute one was even… 
2178," fact: warren can not even sustain her own campaign with your socalled 

she pushed… "
2179, biden or warren
