,text
1348,_indie i wanted that ticket so bad buttigieg/rice would for me have been everything
1349, does your model take in account early voting like the recent contributions biden cannot spend befor… 
1350,my twitter feed is all elizabeth w and pete buttigieg but my philosophy is fighting for someone i dont know as a g… 
1351,biden nabs klobuchar buttigieg backing on super tuesday eve 
1352,how’s this point for democrat uselessness buttigieg & klobuchar drop out basically at the last minute to coales… 
1353,cnn is reporting pete buttigieg the first prominent openly gay presidential candidate is leaving the race how soo… 
1354,why so many pete buttigieg supporters are suddenly turning to bernie sanders via 
1355, was not buttigieg's mother also white
1356,joe biden does want pete buttigieg for vice president despite mocking his experience as mayor considers endorsing h… 
1357, the paramaters of the race changed with klobuchar and buttigieg dropping out it's likely warren and… 
1358,"pete buttigieg is endorsing his former democratic rival joe biden for president

two people familiar with buttigie… "
1359,"""pete buttigieg plans to endorse joe biden for the democratic presidential nomination"" "
1360,breaking gay us presidential candidate pete buttigieg drops out of race 
1361,twitter buzzing over a charter flight going from little rock (where jill biden is) to south bend (where pete buttig… 
1362,trump claims democratic primary 'rigged' against sanders after klobuchar buttigieg drop out 
1363,buttigieg very disappointed with pete's endorsement of biden it will hurt the influence he has with me going in… 
1364, presidential endorsements: senate candidate mark kelly is backing joe biden 
1365,buttigieg set to endorse biden as super tuesday looms smartnews 
1366,we said on saturday that klobuchar and buttigieg would be gone by wednesday😲 you too could get tomorrow’s news yes… 
1367,thrilled to announce that i made it through his entire candidacy without ever learning to pronounce buttigieg’s name
1368," i'm so happy pete endorsed biden 

i stayed up all night writing this for us… "
1369,klobuchar and buttigieg to appear *together* tonight endorsing biden holy shit they *really* don’t like bernie to… 
1370,"buttigieg to endorse biden at dallas rally
 biden&bernie set the ticket now & beat trump wi… "
1371,traitors to democratic principles traitors to a sense of fairplay and decency to take millions of dollars from pe… 
1372, candidates dropped out in hours all of them being from levels of popularity from semirelevant to a potential… 
1373,pete buttigieg plans to endorse joe biden for the democratic presidential nomination 
1374,i could be from convinced that south bend indiana is not real and pete buttigieg is actually a mormon from salt lake city with kids
1375, what these delegates are allowed to do varies slightly based on state laws and state… 
1376, _morris voters that support the centrist candidates mostly support sanders as their second choice… 
1377,what does it mean to call it quits after the south carolina primary a wave of democrats dropped out of the race f… 
1378," build your cabinet
 sec of state
pete buttigieg amy klobuchar michelle obama kamala harris

… "
1379, so i'm probably being super petty but i noticed that biden did not send out a tweet to amy congratulatin… 
1380,"that make two asses in one post should i add fauxcahontas warren maybe comrade sanders 
 i think so oops… "
1381,and here too unityrallly in dallas 
1382, final vote percentages on the endorsement ballot were: sanders (%); warren (%); biden (… 
1383,"warren
klobuchar
buttigieg 

each one is an evilsadistic backstabbing fraudthey care more about advancing their… "
1384,_foo it’s hard to say because we don’t know wha… 
1385,the dnc thinks its so clever lol buttigieg & klobuchar drop out & then endorse biden thinking this way they can… 
1386,sen amy klobuchar and mayor pete buttigieg to back joe biden after dropping out of presidential race 
1387,obama tells buttigieg to endorse biden bernie berniesanders notmeus myberniestory _identity… 
1388,nolte: pete buttigieg’s failed campaign was built on hate and lies 
1389,watch it come out that it was actually who made buttigieg and klobuchar drop out (by putting a gun to their heads)
1390, i speculate more like % biden / % bernie for warrenbuttigieg voters
1391," yes silly berner knows nothing about the harsh realities of politics

he only ran… "
1392,the fact that klobuchar and buttigieg are endorsing biden tells us a lot about the dishonest project they are all a… 
1393,"what happens to early votes already cast for klobuchar and buttigieg

"
1394,“by every historical measure we were never supposed to get anywhere at all” buttigieg reminded his hometown crowd… 
1395,klobuchar buttigieg to back biden at rally in super tuesday state of texas 
1396,"i thought queer pete had more spunk than to cower as if he were quid pro demencia d’oh’s pet pussy 

"
1397,live from the buttigieg rally tonight 
1398, unity and pete is awesome i was cheering for himb&b biden and buttigieg
1399, biden's catastrophic candidature did not fix itself overnight to see the establishment pulling the plugs on… 
1400,deep state + joe biden = tla john brennan can’t wait to smooch biden’s backside now that klobuchar and buttigieg a… 
1401,in four years i will be honored to vote for either amy klobuchar or pete buttigieg
1402, i wish buttigieg would run for the senate we need to turn the senate blue
1403, buttigieg already dropped out
1404,buttigieg and klobuchar to endorse joe biden; harry reid also backs former vice president 
1405,if klobuchar is endorsing buttigieg (as i understand) then why in the world were they attacking each other nonstop… 
1406, yes and that’s why after pete buttigieg dropped out i am backing 
1407, welcome to the grand old democratic party well that was fast 
1408,a morning consult poll taken feb for example before buttigieg exited the race showed that % of his supp… 
1409,it's usually a good idea not to get your politics from celebrities (with a few exceptions) her support of buttigi… 
1410," let me guess

he'll criticize ""the establishment"" & insist they're scared of sanders' ""movem… "
1411,"""overall sanders collected million from the bay area buttigieg million warren million biden … "
1412, yes indeed secretary of state pete buttigieg
1413, me too if we do not vote for her we nullify her candidacy i'm disgusted with th… 
1414,pete beat: pete buttigieg to drop out of the democratic presidential campaign 
1415,pete beat: pete buttigieg to drop out of the democratic presidential campaign 
1416,"buttigieg’s unlikely run ended last night as strangely as it began 
"
1417,buttigieg and klobuchar really endorsed this mf all because they don’t like bernie 
1418,the field is narrowing and the endorsements are going to biden 
1419,"as billionairebacked buttigieg drops out sanders is even better placed to defeat trump

by via… "
1420,"trump is so afraid of joe biden that he's making ish up

here he is accusing biden of corruption b/c buttigieg & k… "
1421,report: obama spoke with buttigieg shortly after he dropped out of race 
1422,"one thing do well is fall in line
amyklobuchar and buttigieg endorsing means the order has spoken"
1423,"did not i tell you all to go after buttiwhocares biden and bloomberg but nooooo

"
1424,homophobic democratic socialists celebrating buttigieg’s decision to suspend his campaign yes folks this is from… 
1425,"media mourns buttigieg exit compares him to george washington 

look at the source a failed republican and his hus… "
1426,"i for one am excited buttigieg and klobuchar pulled out of the democrat race

i mean what could be more thrilling… "
1427,"""klobuchar and buttigieg are endorsing biden as the democratic party’s “moderate” (or shall we say “establishment”… "
1428,"much like with pete buttigieg i was surprised to hear that amy klobuchar had suspended her campaign

i wish them… "
1429,"for all who worked hard on klobuchar/buttigieg's campaign:
thank u for ur hard work do not be disappointed these t… "
1430,_michaelson do his supporters know that or are they still calling buttigieg a rat
1431, have happened but for donald trump's stoking of our fears and abandonment of basic human decency with the end… 
1432,winning for sureklobuchar&buttigieg have sold their souls to the dem partyanother win but consequences for their… 
1433,"all according to plan 

""buttigieg's planned endorsement comes as fellow moderate sen amy klobuchar (dminn) als… "
1434,the line to see former vp joe biden biden expected to officially pick up major endorsements ahead… 
1435, not that it matters so much right now but this is interesting
1436,houston (ap) — rivals no more amy klobuchar and pete buttigieg united behind joe biden’s presidential bid as the d… 
1437,amy klobuchar and pete buttigieg are coming together to put joe biden over the top via 
1438," i don’t think she hates anyone just because 
amy klobchar and pete buttigieg got 
into… "
1439,trump falsely accuses biden of quid pro quo after buttigieg and klobuchar drop out via… 
1440,_rosenberg more likely the big funders are bailing & telling klobuchar & buttigieg there will not be any more it… 
1441,"🟢 biden
🟢 bloomberg
🟢 gabbard
🟢 sanders
🟢 warren
❌klobuchar
❌buttigieg
❌steyer
❌patrick
❌yang
❌bennet
❌delaney
❌boo… "
1442,_icon_mika we have data on second choices does not take a lot to see buttigie… 
1443,things moving fast buttigieg and klobuchar have both suspended their campaigns to endorse joe biden now critical… 
1444,"smart for buttigieg and klobuchar to acknowledge their impact & exit the race for super tuesday

leaves only bloom… "
1445,i said this myself as soon as i heard klobuchar dropped out i doubt buttigieg will be considered for anythingh… 
1446, _spidey biden/buttigieg ticket yes pls would you imagin… 
1447, *🤡 *🤡 cite your source dipshitwhere’s the evidencelying whiny cry baby so thr… 
1448,pete buttigieg plans to endorse joe biden for the democratic presidential nomination 
1449,politics are so fucked up rigged this shit again having klobuchar and buttigieg drop out days before super t… 
1450, buttigieg packed it in and pulled out early
1451, also buttigieg and klobucher have endorsed biden
1452,does anyone else want to know what buttigieg and klobuchar were offered by the dnc to bow out of the race and to… 
1453,pete buttigieg set to endorse joe biden after talking with obama as super tuesday looms 
1454, democratic presidential candidate and former vice president joe biden told a reporter that he would ask… 
1455,just heard from my inside source that buttigieg has endorsed david dobrik
1456, be back soon buttigieg
1457,after today's events klobuchar & buttigieg dropping out & running to endorse biden anyone who was thinking of… 
1458," amy klobuchar and pete buttigieg do not like warren bloomberg and sanders

trump will stomp all o… "
1459, same here not a volunteer organizerbut my life has been consumed w/pete… 
1460,looks like super tuesday tomorrow is turning into a two horse race between sanders & biden with many moderate candi… 
1461,"so i was talking to someone today about pete buttigieg dropped out of the race
them: ""i was not interested in him o… "
1462, the op is about warren dropping out to endorse bernie like buttigieg and klobuchar did for biden an… 
1463,breaking: pete buttigieg drops out of race 
1464,"warren bloomberg biden and sanders are likely the last debaters left this winter
klobuchar exits after buttigieg… "
1465,woooot “pete buttigieg to endorse joe biden for president” 
1466,biden surges higher with klobuchar buttigieg endorsements 
1467,can you imagine vp candidate pete buttigieg in a debate with pence riveting
1468,uk | egaylity : pete buttigieg america's first openly gay major presidential candidate has quit the race for… 
1469, one of the things that really struck me after iowa and nh was that buttigieg did not repor… 
1470,uk | egaylity : pete buttigieg has announced he is ending his campaign for the white house after his campaign… 
1471, they figured it out pretty quickly maybe now to see if the buttigieg / klobuchar supporters move to bi… 
1472, they are sold out of everything useful though because of coronavirus panic shopping so good lu… 
1473, sec of state pete buttigieg is my hope
1474, i met a buttigieg supporter today who is now supporting bernie i hope this move backfires on them in a big way
1475,something seems fishy both buttigieg and klobuchar dropped out and are immediately endorsing biden dnc is pull… 
1476,amy klobuchar and pete buttigieg are coming together to put joe biden over the top via 
1477, and if the warrenbuttigieg voters split % sanders % between biden and bloomberg that leaves… 
1478,"i wonder if pete used his obama voice with obama as they were working out a deal 
"
1479,"early super tuesday voters who chose buttigieg or klobuchar wasted their votes
this is another reason to use… "
1480,"klobuchar ends bid set to join buttigieg in biden endorsement ahead of super tuesday

"
1481,this is who we are endorsing now really ok buttigieg ok klobuchar 
1482,"fakemedia mourns 😭😭 exit compares him to george washington 😳😳❓
""how high he'd flown"" 🤔
like icarus… "
1483,buttigieg fell short of his goal to win the democratic nomination and defeat president donald trump but his candid… 
1484, hey beautiful people pete amy bernie whoever supporters more pete followers are following ber… 
1485,"buttigieg: *drops out of presidential race*
klobuchar: okay i get it let me think i guess it's my turn"
1486,in klobuchar's case i do not know if that was inevitable or a function of a lack of time and money in nv and sc ma… 
1487, a disaster that most democrats want someone else i will support sanders if he wins b… 
1488,for klobuchar supporters who picked buttigieg as their second choice i used the buttigieg secondchoice distributi… 
1489,_photog _photography how can we ever repay your sacrifice and taking one for the te… 
1490,taking klobuchar’s buttigieg’s and steyer’s overall percentages and multiplying it by their supporters’ secondch… 
1491,amy klobuchar and pete buttigieg are coming together to put joe biden over the top via 
1492,small thread on why nothing has really changed now that buttigieg klobuchar and steyer are gone this is my own t… 
1493, i'm sure biden probably promised them something at least implicitly: eg attorney general for klobu… 
1494,"president: biden

vp: harris

ag: schiff

sos: klobuchar

defense: buttigieg

treasury: warren

energy: steyer

hhs… "
1495,pete buttigieg dropping out of the race is the best birthday present i have ever gotten
1496,why attack buttigieg trump’s the draft dodging liar and traitor while i was in vietnam he was avoiding the draf… 
1497,buttigieg goes out with style grace and a bright future 
1498, forget about warren she is not with us klobuchar and buttigieg have more solidarity for… 
1499, angeleno here — i went from buttigieg to booker then i was a little homeless warmed to warren quit… 
1500,if you did a mailin ballot in ca and your candidate has dropped out do not go to the polls tomorrow thinking a new… 
1501,obvious russia has kompromat on buttigieg klobuchar and warren 
1502,"""williamson endorsed sanders last month at his rally in austin texas""
"
1503,thought i saw pete buttigieg on the subway but it was just some guy
1504, i’ll pray for that delusional woman what a true pleasure pete buttigieg is how fortunate to get to k… 
1505,"bernie

republicans and corrupt dems are shitting themselves that's why the forced klobuchar and buttigieg out"
1506,breaking: pete buttigieg drops out—how will this impact the  race… 
1507,"talking about corruption a la dnc style 
first buttigieg and now klobuchar

dnc gets what dnc wants "
1508, the impact on downballot contests from having surrogates like buttigie… 
1509,"pete buttigieg will endorse joe biden for democratic nomination (new york times)


"
1510, lots of cash plus a staff position should biden or the guy who probably paid buttigieg gets elected
1511,"if you want to watch the unityrally with pete and amy 

it will be on cspan at : pm eastern

h… "
1512," on what could be in store for pete buttigieg now that he's out of the presidential race: ""i was talki… "
1513,buttigieg: i'm going to write an essay about how cool bernie is but endorse biden
1514,trump says buttigieg's exit a sign dems trying to stop bernie sanders foxnews
1515,i am among the hundreds of thousands of former viewers who will not be watching michael moore never apologized for… 
1516,breakingnews: petebuttigieg will endorse joebiden at a rally tonight at the same time as amyklobuchar just one… 
1517,whenever i say buttigieg i sound like drunk crowley trying to say bouillabaisse
1518,for instance i've made my disdain for pete buttigieg clear & his plan to endorse biden does not dispel that howe… 
1519,tonight: biden set to hold rally in dallas where buttigieg and klobuchar are set to endorse him tune in at :et… 
1520,"i think he just did not want to catch the corona virus

pete buttigieg ends his historic presidential campaign cn… "
1521,breaking: new york times endorses both amy klobuchar and pete buttigieg for vice president
1522,nolte: pete buttigieg's failed campaign was built on intense hate and serial lies 
1523,sadly some diehard bernie fans will vote for trump or withhold their votes out of spite if you support bernie then… 
1524,the only national poll postsc had just a point sanders lead and that was before buttigieg and klobuchar quit b… 
1525,pete buttigieg more like pete booty peg
1526,pete buttigieg to endorse joe biden at rally ahead of super tuesday 
1527, i don’t see how buttigieg is an asset to a biden ticket
1528, depends on the state but most end up going to the convention uncommitted but expected to vote for… 
1529,moderate democrats are rallying around the candidacy of joe biden ahead of tomorrow's super tuesday primaries nbc'… 
1530," they all got their marching orders on march st pete buttigieg endorse joe biden 

a… "
1531,pete buttigieg’s slimy attempt to grab a photo op goes horribly wrong… 
1532,i voted for pete buttigieg i voted for amy klobuchar can we get our votes back 
1533, they're not but since those delegates represented moderate candidates (klobuchar/buttigieg) is not… 
1534,_atheist i think even you have to acknowledge the qualitative and quantitative gaps betwe… 
1535,pete buttigieg quits democratic presidential race 
1536, child credit tax return here food stamps welfare what cha… 
1537, it would be respectful of you to back off interpreting mr buttigieg's personal story it would als… 
1538,trump falsely accuses biden of quid pro quo after buttigieg and klobuchar drop out 
1539,"alright by popular demand

here's pete buttigieg is gone full version "
1540,us supporters are fighting against the establishment and yes that establishment includes biden buttigi… 
1541,tulsi gabbard is outlasting buttigieg and klobuchar 
1542,biden nabs klobuchar buttigieg backing on super tuesday eve 
1543,_icon_mika klobuchar and buttigieg dropping out plus biden surges in almost all postsc poll… 
1544,pete buttigieg is the exhalted one i am certain about this
1545,"klobochar is out buttigieg and yang are out funny how the dems promote ""inclusion"" and ""diversity""
no women n… "
1546,buttigieg steyer klobuchar exit reveals need for ranked choice primary voting 
1547,"klobuchar buttigieg endorse former vp joe biden on eve of super tuesday 
"
1548,"someone’s gotta say it so i’m gonna 

pete buttigieg looks like he could be mr bean’s brother"
1549,"bloomberg: klobuchar and buttigieg ""behaved themselves"" 

hey mini how muc… "
1550," this is such a wrong headed and offensive tweet 

i canvassed for ten hours yesterday three… "
1551,biden buttigieg get my vote otherwise no
1552,_krj governor buttigieg has a nice ring to it
1553,this is what i’m talking about let’s unite our party 👏🏾👏🏾👏🏾 pete buttigieg plans to endorse joe biden for the dem… 
1554,_tx “because buttigieg has not filed paperwork to formally withdraw his candidacy votes fo… 
1555,"""the most immediate impact of the klobuchar & buttigieg exits will be sighs of relief from political writers who no… "
1556,buttigieg took a giftand then said see ya demdebate 
1557,trump total meltdown after buttigieg and klobuchar drop out via 
1558,pete buttigieg did better than warren in all four states but dropped out to endorse biden the other moderate amy… 
1559,similarly i feel like she takes votes from klobuchar and buttigieg and biden as much as from sanders do biden and… 
1560,"pundits (after iowa): it’s all about buttigieg
(after nh): klobuchar is gaining ground
(after nv): it’s sanders’… "
1561, warrenbuttigieg voters will have a different set of third choices than buttigiegfirst voters th… 
1562,‘kasichmentum’: michael bloomberg says he feels sorry about pete buttigieg and amy klobuchar but he’s ‘in it to win… 
1563,i'm expecting both klobuchar and buttigieg to get million book deals within this calendar year 
1564,looks like dropping out has finally brought them together both pete buttigieg and amy klobuchar will attend joe bi… 
1565,if by some calamity wins race buttigieg will be appointed director of cia (they need someone to bur… 
1566, tulsi gabbard should have dropped out months ago she's embarrassing herself and buttigieg should… 
1567,buttigieg and klobuchar dropping out and endorsing biden still does not get biden more delegates than bernie i'll w… 
1568,pakistan biden gets double bump as klobuchar buttigieg exit before super tuesday 
1569,"big decisions day:
rebrands or survival of fittest channel ('rebrand' neil perry ('rebrand') buttigieg (someone… "
1570,yes there are a lot of assumptions here about biden's sc bounce and the effect of the buttigieg and klobuchar wit… 
1571,"i myself am amazed by the doublethink:

""buttigieg drops out it's a plot against bernie""

""warren stays in it's a… "
1572,"evening arriving not long after biden’s rally begins”

“the buttigieg team has been silent about this for hours b… "
1573,"me: no fear
political pundits: 'at his age buttigieg has four decades to try to become president'
me: one fear"
1574,amy klobuchar tonight is endorsing joe biden in dallas pete buttigieg tonight is endorsing joe biden in dallas an… 
1575,"cringe

pete buttigieg plans to endorse joe biden for the democratic presidential nomination "
1576, and trump will eat biden alive mark my words the only one able to defea… 
1577,buttigieg to endorse biden on eve of super tuesday 
1578,"klobuchar ends democratic presidential bid set to endorse biden as same as buttigieg
democratic party establishme… "
1579,"exactly what is buttigieg's ""enormous talent""
is it that he was a completely unimpressive mayor of a midsized cit… "
1580,it appears a ghost has escaped from the haunted mansion ride and has been endorsed by pete buttigieg and amy klobuchar
1581,"goodbye pete buttigieg you were always more of a symptom than a cure | richard wolffe ""something more meaning… "
1582, i'm struck by the idea that the dnc if this was their strategy should have told biden to drop out and… 
1583,"the words ""postbuttigieg/klobuchar endorsements"" were put in there for a reason

if those pledged delegates voted… "
1584, that is why my tv is on cnn right now especially since moore has never been calle… 
1585, buttigieg sure but these are the people i want to see more of
1586,"""the decision comes one day after former mayor pete buttigieg of south bend ind departed the race & after weeks… "
1587, unfortunately some of us already voted for buttigieg i ran down to my mail box to see if i could get it back but
1588,inbox: who had endorsed pete buttigieg endorses joe biden 
1589,joe biden says if he wins he'd ask pete buttigieg 'to be part of an administration' 
1590,i love the buttigieg family 
1591,kind of surprised to learn that warren is more narcissistic than buttigieg didn’t see that one coming
1592,nolte: pete buttigieg’s failed campaign was built on hate and lies via 
1593,sen amy klobuchar and mayor pete buttigieg to back joe biden after dropping out of presidential race 
1594,buttigieg and klobuchar to endorse joe biden; harry reid also backs former vice president 
1595, our household is going to biden now that buttigieg is ou… 
1596,buttigieg dropping made me suspicious but klobuchar makes me very concerned
1597, i was gonna vote for buttigieg tomorrow now i don’t know
1598,"it's as if bernie has a bad case of socialits his rivals do not seem to hold him in high esteem why is that
 "
1599,pete buttigieg set to endorse joe biden after talking with obama as super tuesday looms 
1600,_train pete buttigieg is an outstanding talent and a true patriot can… 
1601,"i'm watching a pete buttigieg commercial and the theme is ""i'm here to stay"" ummmsomebody forgot to cancel the… "
1602,pete buttigieg i’m sorry (tyti daily) via 
1603,what’s next for pete buttigieg 
1604,seeing that it’s supertuesday (tomorrow for us) and the moderate dems went “nuclear” with kobluchar and buttigieg… 
1605,obama nudged buttigieg in direction of biden endorsement via 
1606,both democratic presidential candidates suspended their campaigns this week 
1607,mayor pete received an instant commission no training and served as a chauffeur in a questionable unit men with… 
1608, _lp _haynes … 
