,text
1081,did i just see a commercial with obama backing warren
1082,"elizabeth warren is polling behind this man and you losers want to tell me it has nothing to do with her gender

o… "
1083,"💯💯💯 this 
the primaries are for you to vote for who you like do not vote the way you think others will how can yo… "
1084, crossing my fingers that chuck todd is next maybe warren can go on his show this week for an interview
1085,warren is holding out for a bigger deal from the dnc poor bernie getting burned again 😛
1086," i can respect that you like warren

 i consider myself to be on the same side as the more progressive w… "
1087,warrenendorsebernie too late we’ve already put our vote in for liz warren in california🤫
1088, elizabeth warren is not a progressive
1089, warren and still warren
1090, love warren she changed the conversation and the race for the better voted for her in the… 
1091,so here's a question for you smart people: if warren gets decimated tomorrow does she drop out and endorse bernie… 
1092, no you don’t and no you haven’t if you had you’d know warren is not that candidate you jus… 
1093, _see_see … 
1094," is the point of this that warren is ruining bernie's chances by staying in the race 

i absolut… "
1095, warren did not end bloomberg dude
1096,warren lands the mythbusters endorsement (well half of it) warren winwithwarren 
1097, bernie isn’t a democrat he attacks the party every chance he gets warren didn’t really have a good campai… 
1098, i'm with you andrea i'll vote for biden if i have to but bernie's a hard pass for me and i think yo… 
1099,warrentobernie is not a real thing warren is taking super pc money something bernie supporters will not tolerate bernie
1100,warren must warrenendorsebernie
1101, his favorability with black voters is better than warren and pete he only loses to biden… 
1102,elizabeth warren vows to reinstate welfaredependent immigration to us | breitbart 
1103,_bau warren came in rd th th and th going well for y'all
1104, how does it undermine they're all still better than the republicans what undermines is saying so… 
1105, _cormack i can’t see how bernie wins unless warren drops out the moderates are all unit… 
1106, jack just gives a blue check to any pmc nobody who supports warren huh
1107,one observation i’ll make is that i’m not terribly impressed by the field operations for the sanders campaign they… 
1108,anyway if u would really pick warren over bernie i think you are dumb ❤️
1109, steve are there polls where people are asked how important it is to elect a younger leader i ask b… 
1110," it's still wide open to win a majority of pledged delegates:

bernie sanders needs … "
1111,i voted for warren by mail 
1112,warren was onto something she's a hero 
1113,watching twitter melt down over warren and sanders has me very happy i do not vote tomorrow
1114, warren will be out your bernie bros will be the final nail in the dem party… 
1115,"warren emboldened bassett to name names 

 let's not play that down 

the sexual harassment claim would not… "
1116, i'm challenging the whole notion of presuming who's viable and and nonviable at this stage she's… 
1117, just because it did not happen to *you* does not mean his behavior was appropriate with others his b… 
1118,i’ll support bernie if/when warren drops out but my god warrentobernie is already trending one thing i could ga… 
1119," conspiracy : 

keep warren in till the end to split the progressive voteand keep it split do you… "
1120,people who insist that warren needs to *sacrifice* her run in the primary to help out bernie for *the good of the p… 
1121,that’s so elizabeth warren 
1122,_plus_twins with continued campaigning and egorallies we could see bernie biden and trump all high risk p… 
1123,in case you were wondering warren
1124,elizabeth warren gets shit done 
1125,_va_ i’m a warren warrior backing bernie if you care about the issues warren cares about he’s really th… 
1126,_ as much as i do not like warren this is a bad line of thinking a vote… 
1127, come on is the better alternative why do we have to keep voting for… 
1128, elizabeth “nails on a chalkboard” warren
1129,if you're in a super tuesday state and have not voted yet and you were considering voting for warren please vote b… 
1130,ma better come through for warren
1131,love reactivating the poisonous well that is facebook after almost a year to do a bernie super tuesday plea to get… 
1132,and now i'm going to have to step away from the internet for a long stretch and i would be so grateful if you read… 
1133, there’s things i have read about elizabeth warren that i have liked & things about bernie i have thou… 
1134, this is assuming that warren is in fact progressive and not neoliberal
1135,"i pledge to vote for elizabeth warren in join me →
"
1136,scary everyone has pushed him over warren if this was warren having this problem she’d be eviscerated 
1137,doing the equivalent of writing in warren to open the libs
1138," joe biden was vp of the first black president 

warren is just another politician there’s nothing special about her"
1139,please refer to page of the assistants for further evidence of my longtime support of elizabeth warren… 
1140, warren will drop out next and then biden will follow bernie wins the democratic nomination in a land… 
1141, but liz warren is totally uhhhh michelle pfieffer in ant man rachel dont you understand that means she should be president
1142, if warren gets % in california or texas that means those % of votes simply don’t count—at all—bec… 
1143,so that the choosewarren people also get it: warren is not hermione she is pettigrew do not be like the potters… 
1144,my superhot take tonight is that if you support warren you should probably vote for her and if she drops out yo… 
1145,"hey supertuesday people who is your candidate biden bernie warren or trump

 bernie biden warren trump"
1146,join me in supporting elizabeth warren via 
1147, pete amy and warren are national heroes
1148, pretty sure warren will do the same after tomorrow 🤷🏽‍♂️
1149," nobody can take pac money that's not how pacs work

she was unable to find big donors becau… "
1150," why not condemn obscene spending
mil buttigieg mil warren mil bloomberg
over billion… "
1151, trump trying to make sure bernie voters vote for him instead of biden/warren
1152, as opposed to what 😂😂😂 warren biden bloomberg trump bernie has fought with us before he is ou… 
1153,i’m not playing any games i actually think the responsible decision for warren given the delegate math is to dro… 
1154, did you walk to school or being your lunch even giving warren ful… 
1155, this is not an attack it wasn’t even proven that it was an offici… 
1156,hey guy on amy was my jam no way in hell would i ever vote for warren because i would have voted for amy
1157,elizabeth warren please drop out for the sake of a better world in these times: … 
1158, you clearly have absolutely no clue what you are talking about warren has not done… 
1159, that's so ridiculous she tried to occupy lanes wasnt as progressive as… 
1160,lmao just saw an elizabeth warren commercial
1161, warren and sanders
1162,fyi i’ll be voting for warren tomorrow
1163,"do the math:

•buttigieg steyer klobuchar drop out
•mass biden endorsements
•cnn denouncing socialism
•warren sta… "
1164,_stp_meee _polls _inc there’s many polls saying many things one says their choice is sanders… 
1165, maybe true that she is already but warren is popular in california and californi… 
1166,"reminder to supporters: 

wall street is more afraid of elizabeth warren 

teamwarren 
_for_warren"
1167,progressives best choice is th place warren over the progressive guy in first gtfo 
1168, _mckay warren can be obnoxious
1169,yet another interesting thing about warren supporters i'm used to the leftist habit that when someone is talking o… 
1170, give tulsi gabbard credit for running a better campaign than bill weld and joe walsh i hope a gro… 
1171," yes yes and yes

i think the ""let's hunt for small dollar donors"" experiment was worth tryi… "
1172, except we know how to read polls and there’s the little matter of warren losing every primary warrenendorsebernie
1173, bernie is a lefty version of trump i do not appreciate him at all for me its between war… 
1174,_bones _g good for you i've said often i'll vote for him in the general happily i th… 
1175,i like warren a lot and was ready to vote for her when it looked like she was the more competitive of the two cand… 
1176,i do not know if i have any followers who like warren and have not voted yet but if you are at all interested in hav… 
1177,_lolpop _agust again i don’t know what point you’re trying to… 
1178," very sorry to make this so explicit but it seems ""warren ted"" at this place and time we live in if… "
1179,_hack_fraud warren women
1180,who should elizabeth warren pick as a vp
1181, the only progressive candidate that could win a general election is warren and sanders… 
1182, warren or bernie joe biden once known as the mnba senator is corporate to the soul sigh voting o… 
1183,"emily’s list endorses elizabeth warren for president

and not a minute too soon presidentwarren"
1184,hi i'm voting for elizabeth warren tomorrow because she's the best person for the job choosewarren
1185, realistically warren has not come close to winning a primary contest yet do you rea… 
1186,finally saw a warren commercial
1187," excuse me
elizabeth warren is still in this race 
let see what the people say tomorrow"
1188,warren should drop out right about now
1189, i’m going with biden he has a better chance to win trump now i was going for warren initially
1190,_cece watching women who support warren let these ww talk to people crazy two candidates dropped out and e… 
1191, when warren drops out tomorrow night join team biden
1192,a lot of them just like warren cuz she’s a woman 
1193,what about the rest of you why do you think someone might come from a place of supporting biden to supporting warren
1194,/ don’t the new folks that sanders (and also warren) bring to the stage seem more open and empathetic a trump… 
1195, it matters bc i’m not representative of the ppl that are on the fence i want warren but i’m ultimat… 
1196,_pam _p_rhodes awesome
1197, this is incredibly obtuse and stupid analysiswhy would ew give her delegates to someone she stabbed in… 
1198, i'm not going to give you shit for it but if i'd have bet against warren doing the right thing times… 
1199, yup this we just saw a seismic shift with sc results three dropouts and mass endorsements biden… 
1200,_sam i was in france in when a very progressive presidential candidate was % away from po… 
1201, _nick omg there are so many examples of w… 
1202,i like bernie and i like warren if you are a progressive that wants to put your vote towards someone who can bea… 
1203, god i hope warren kicks their asses
1204,it’s days before the illinois primaries and honest i’m not sure who i will vote for: so far my top three are:… 
1205, i do not think he's afraid of biden i think he just figured biden would be the nominee so now he's ba… 
1206, bernie happens to be a man who fights for progressive values: ma money out of politics and gnd i… 
1207,_gailey so you will not fight for medicare… 
1208, if sanders wants warren to stop “attacking” him and promise to pledge her delegates to him i sure hope… 
1209, except warren (who i like very much) has no aa support you can not win without it we're not a predomi… 
1210, well i mean being vp and creating the violence against women act are quite significant i’… 
1211, warren was a shit load of people's second choice moderates like her on the economy progressives like… 
1212,i must ask if sanders has shown himself to be a racist misogynist homophobic transphobic bigot why would any… 
1213," perhaps no one does

🤫

in the ge she is more electable than bernie and m… "
1214, most polls have shown her support would spread out fairly evenly amongst the other candidates the onl… 
1215,matthews has faced mounting criticism over a spate of recent embarrassing onair moments incl a comparison of sen… 
1216, you've dropped the idea that i accused you of something you've ignored your initial rant about (my) not… 
1217,stop telling warren to drop out the moderates doing so may be threatening but we don’t have to do the same this… 
1218, are we pretending the only diverse candidate left is elizabeth warren bernie is not just another guy h… 
1219, he was incredulous that warren would believe a woman over bloomberg co… 
1220,as much as i prefer warren to win i have to give sanders credit for running a strategic campaign though i do ques… 
1221,i wish it wasn’t true but i think a vote for warren is a vote for biden now we tried a centrist with no message l… 
1222,now i pick warren warren
1223,"warren elizabethwarren has my vote
in soca eastlacc tonight 
it's time 
votebluenomatterwho… "
1224," how do either actually accomplish that though

especially if the democrats do not take the senate which… "
1225, you’ve got that backwards the gop has so much dirt and footage on bernie th… 
1226,if you consider yourself progressive and still vote for warren tomorrow i've got some news for you
1227,"trump: ""warren will probably lose the state of massachusetts to bernie"""
1228, me too warren 
1229,"""the rest of the state of massachusetts looks a lot less like boston and more like the rust belt a place where dei… "
1230, warren or kamala for vp 
1231, i’m sorry buttigieg supporter’s choice is warren cause 
1232,warren supporters: if you vote for liz tomorrow you're essentially going third party let me know if you need any t… 
1233," on warren trump says ""those embers that were burning they never caught on"" he predicts warren will lose massachusetts to sanders"
1234, i've got news for you women were not voting for amy just because she's a woman we too are concerne… 
1235, 😢 i think so too elizabeth warren has the guts brains and integrity to do this 💪🏾
1236, he’s the only candidate that can beat trump he has the support of a more diverse base than biden or warren 
1237, has a slight advantage over bernie for the first time no one has / probability to “win” now (per … 
1238,i'm seeing lots of warren supporters banking her chances on bernie's heart giving out which is both incredibly fuc… 
1239, if debates mattered then hilary would be potus right now & we wouldn’t be dealing with orange catast… 
1240,like warren i had my own sexist runin with chris matthews via 
1241, leniere with all due respect to you seriously; there is no more time for handholding… 
1242, his health is fine he's active every day and travels nonstop… 
1243, yes he was fired/forced to retire for sexual harassment also warren literally dragged him postnv deb… 
1244, i completely support senator warren staying in this race she is still my favorite candidate and i a… 
1245,"go away win with warren
never bernie "
1246, warren does not have a path to the nomination her best bet would be to drop out endorse sanders… 
1247,_was_bant i also have trouble thinking of them that way but the s are actually ov… 
1248, i saw a poll that pete supports go to bernie in a higher percentage than anyone else the best we can… 
1249,i’m not saying that not supporting sanders or warren is what proves they’re dumb but the “analysis” of candidates’… 
1250,_bones very early on i was a julian person then i had to decide between warren… 
1251,impeachedtrump is shaking in his boots if biden wins the coup sill be in november when gets his… 
1252, _aria_blooms joe and warren have nothing in common inna
1253,warren can not do shit trump would destroy her and fuck whatever is left she is a sociopathic liar and flip flops o… 
1254, consider listening to your heart i've seen multiple people stating the same thing : warren is their… 
1255, warren hasn’t been a practicing lawyer since the ’s law profs generally don’t have actual litigation s… 
1256, and many of us feel warren is a superior candidate and her fight and determination will prevailhope springs eternal
1257, yes and krystal ball said correctly we don’t need a gender token america has already spoken that a wom… 
1258,_iron i agree with you completely on all of your concerns i like warren’s agenda and would like… 
1259,_smith i literally will switch from warren to biden i don’t care
1260,_hoops i think either one will be good for em jr play elevates when he linked up wit bron
1261, i'd be lying if i said this has not crossed my mind a few dozen times today i think this might push wa… 
1262,warren trying to find a path to the nomination 
1263,"oh hey is not this the truth ""don’t play yourself if other people don’t like the candidate you like let them vo… "
1264," biden will capture more of the vote 

he wants bernie so he his minions and the putin cyberops can s… "
1265,_sassenach i lean more progressive than biden too but i have a hard time trusting warren i… 
1266, yep if warren dropped out tonight and bloomberg didn’t be… 
1267, unite behind anyone and we can make real change stop acting like joe biden will do anything to stop… 
1268, okay now use that same voodoo on warren please
1269," as of march 

sanders
%
 
warren
%
 
biden
%
 
bloomberg
%"
1270, we’re still listening ms warren keep right on talking 💪🏼
1271,from what i understand and i am not an expert but i know enough to listen to people who are from a purely numbers… 
1272," warren is still a contender

bernie = 
biden = 

to win the nomination on the first ballot a d… "
1273, i wish obama would endorse warren
1274, _geier that broadbased coalition is called sander's motherfucking… 
1275,elizabeth warren's campaign is now about keeping bernie sanders from winning paste bernie 
1276, gotta go with warren
1277," 
erin i agree with your guest 
(march h_abdul elsayed)
that biden's message is the dem version… "
1278,realistically anyone running for president has an ego you think you can run this country best in that regard sa… 
1279,warren is not a progressive stop fuckijg associating her with the movement holy fuck tyt has become fucking ut… 
1280, warren is brilliant and always has a plan and she acts on it in partnership with others… 
1281,"contested convention loses rbg's seat
biden's brain is oatmeal
independents despise warren more than trump
bloom… "
1282, and what happens if in the th hour trump’s cronies pull out dirt on biden and he’s our only pick people w… 
1283, proving the point that democrats care only about importing voters who ca… 
1284, warren but blue no matter who
1285, warren will never endorse bernie
1286, i base it on my belief in warren herself if she believes she has a path i believe her and support her
1287,"""an interview with senator elizabeth warren in which the anchor was criticized for a condescending and disbelieving… "
1288,bernie needs delegates to win biden needs to win warren needs to win this is not a two person race teamwarren
1289, ok i think is right that you're a bot but one more time: ca has a big wealthy d… 
1290, why is that the question most of the purely ideological support warren had already went to sanders t… 
1291,"trump on elizabeth warren: ""she's history"""
1292,"""chris matthews was gone and i thought is elizabeth warren finally going to get to finish a sentence"" "
1293, i've been a warren supporter since she announced her candidacy but the good folks of… 
1294,"i do think warren is gonna take more moderate votes (former pete & amy) than split the progressive votes
( i did n… "
1295,there is one candidate that can actually accomplish these things there is one candidate who has the record of acti… 
1296, aka pro bernie pacask warren to stop attacking their candidate and pledge her delegates to… 
1297," too late you had to say it on cnn on night of your time there during iowa 

wa… "
1298, _moviebob i'm glad you can see the humour in trump winning another election and killing more people b… 
1299,warren takes shots at bernie reiterates intent to steal election via 
1300,like warren i had my own sexist runin with chris matthews via 
1301,bernie sanders’s elizabeth warren problem hey we're with you stay in the race womenforwarren
1302, you mean the warren that’s been in solid fifth you mean the bernie that’s won the first thr… 
1303,if warren cared about this movement and the people in this country as much as she says she does then she’d drop out… 
1304, i honestly don’t know what else he can do at this point tweet out his tesla’s new persona… 
1305,one can deduce that the dnc told buttigieg and klobuchar to drop out and told warren to stay in fuckthednc
1306, dude there are still states to go bill clinton did not do well in po… 
1307, actually it did and i am warren supporter
1308,i was torn between bernie sanders and elizabeth warren in super tuesday until i realized something important abou… 
1309,almost every warren supporter i know has a doctorate and the ones who do not are also well educated as wellcould… 
1310," where are the family units 

as liz warren would say
where's
mamas & the babies "
1311,not hillary above warren 😭😭😭 
1312, trump feels he can beat bernie he never mentions warren
1313, hillary wasn’t a progressive warren said the primaries were rigged hillary was under f… 
1314,i’m justif it was the amy thing why not back warren when klob made those “big tent comments” to send an actual message
1315, been with warren since day because america needs her big time 
1316,_watson i love elizabeth warren but bernie has two key unique positions that i feel strongly about (prisoner… 
1317," %
% of delegates
i do not get a vote
i'm voting for elizabeth warren becau… "
1318, also while he was doing this warren was passing bills
1319,"/ what was i trying to share 

team warren was sooooo incapable of running a ground game they couldn’t even gi… "
1320,@_ashlake_ _bernie that is not supported by evidence as i see it… 
1321,"after that insulting interview the other night with elizabeth warren i wondered why he was still employed 
time f… "
1322,all these people jumping from warren to sanders are the reason i have lost faith in the democrats literally could… 
1323, all power to warren i would add that matthews’ nasty comments about sanders also contributed to his firing
1324, warren should drop out
1325,"also elizabeth warren that’s it

 "
1326, it’s going to be interesting to see how much or little she drops due to people voting l… 
1327, she is warren 🔥
1328, _dc he did have what i thought was a bit humiliating talk with warren a back & forth abou… 
1329,biden too moderate bernie too radical bloomberg too bloomberg there is a candidate still in the race who want… 
1330," i liked him sometimes but he did have his "" flaws "" the other night when he interviewed warren after th… "
1331, joe sucks we need elizabeth warren she will bring home the bacon
1332, you get that neither of those impressions are actual data two sanders su… 
1333,"nah man fetishizing the idea of women's power rather than women's liberation is sexist

warren should drop and sh… "
1334, warren is not in it to push progressives she is in it to spoil bernie's chances hillary… 
1335, choosewarren in the end i’ll votebluenomatterwho but supertuesday it’s warren 
1336, who are they getting behind i love warren but you americans can not handle a woman in charge so go with biden
1337," _girly only berniebeatstrump

good luck beating trump with the milque… "
1338, warren is staying in to hurt bernie they are all on the same team
1339,_for_warren don is clearly a sub
1340, _cormack when you couple that with warren's expected dropout that is anyway we're only speculati… 
1341,_misfit … 
1342, i think this is a better message you set forth why bernie is better than warren on this issue… 
1343, you dont scare me win with warren never bernie
1344,i'm going to choosewarren because i still think is the best possible candidate to run this country with s… 
1345, still waiting for those sources on how great warren has been for the working class
1346, when warren throws her delegates to bernie at the convention i expect bernie fans to thank her for ign… 
1347, super pacs do not organize with campaigns do not coordinate with campaigns (this would be illegal) and… 
1348,on the other hand bernieendorsewarren is something i can get behind at least because bernie admitted he does not k… 
1349,bernie is even coming for the etsy vote it’s officially over for warren 
1350, warren also has problems with black voters i love her policies
1351, / ocwen can’t help you even though they knew they had made huge errors & we had… 
1352,"like yeah i prefer warren because she’s laid out her policies in detail

but

we’re picking between perfectly g… "
1353,wow warren vanquishes another toxic man i do sincerely hope he has learned from his past behavior and will bett… 
1354,as a single mother having warren’s plan when my kids were prek would have been lifechanging 
1355, i am a warren supporter and i will likely not be voting for bernie even if she does endorse him all of… 
1356, i'm with warren but she may not have a path to enough delegates so i'm with 
1357,_warren you right you right 😳
1358,now i'm not saying all his supporters are assholes just the ones who are being dicks about warren
