,text
2150, but does not it also make harder for them to win any state buttigieg and klobuchar's suppers are ove… 
2151,pete buttigieg drops out of democratic primary ahead of super tuesday 
2152,pete buttigieg never looked more like a winner in turning the prize away theinfiniteage petebuttigieg… 
2153,"trump on buttigieg and klobuchar endorsing biden harkening back to impeachment:
""probably they'll say 'hey look… "
2154, go to them peter buttigieg
2155, thanks for the update i hear amy endorsed biden what about buttigieg
2156,"the dem donors behind buttigieg had to put there money somewhere😂

biden campaign raised m within hours of buttig… "
2157, pete buttigieg and amy klobuchar will end up voting for trump
2158,minnesota sen amy klobuchar is suspending her presidential campaign; along with pete buttigieg she's the second c… 
2159, what would you call obliterating bernie with the black vote in south caroli… 
2160,buttigieg steyer klobuchar exit reveals need for ranked choice primary voting 
2161, amy klobuchar and pete buttigieg united behind joe biden's presidential bid if nothing else he’s a… 
2162,"pete buttigieg should join don lemon and anderson cooper at cnn
a perfect trifecta 😂😂🤫🤔"
2163,bloomberg: klobuchar and buttigieg 'behaved' this was trial run for the two they have succeeded in getting name &… 
2164,buttigieg steyer klobuchar exit reveals need for ranked choice primary voting 
2165,new post (klobuchar buttigieg to back biden at rally in super tuesday state of texas) has been published on news b… 
2166,"amy klobuchar and pete buttigieg set to endorse biden at evening rally – live
"
2167,well my prediction was correct buttigieg klobuchar and steyer out
2168,pete buttigieg and amy klobuchar are throwing their support behind joe biden after dropping out of the race th… 
2169,pete buttigieg's unlikely path over the last days exceeded virtually everyone's expectations of his presidential… 
2170,"bernie supporters need to brace themselves for yet another forfeiture of his nomination

steyer klobuchar and bu… "
2171,klobuchar buttigieg to back joe biden after dropping out of presidential race via 
2172, i can see it nowkamala harris as agpete buttigieg as vice presidentwould be a h… 
2173,i wanted buttigieg and steyer to drop out and wish bloomberg would too 🤔 
2174,trump falsely accuses biden of quid pro quo after buttigieg and klobuchar drop out usrc 
2175,"from three years ago: ""with rust on his resume and a pickup truck in his driveway many democratic analysts think b… "
2176,i would love to be a fly on the wall when amy klobuchar and pete buttigieg meet up tonight
2177,*note this was published friday before buttigieg and klobuchar dropped out of the race—so it features some of my p… 
2178,thinking about obama and buttigieg having a phone conversation and i imagine it would be like those videos where pe… 
2179, if both klobuchar & buttigieg are endorsing biden i guess it’ll be a landslide for trump or as joe says… 
2180,anyone else think it’s kind of sus that buttigieg and klobuchar drop out right before super tuesday and quickly end… 
2181,biden vs sanders endorsements: buttigieg klobuchar and other highprofile support ahead of super tuesday 
2182,a heartfelt column from a former federal prosecutor whose firing the justice department authorized when the fbi dis… 
2183,biden nabs klobuchar buttigieg backing on super tuesday eve 
2184,gyuk | pete buttigieg quits the race for the white house: pete buttigieg has announced he is ending his campaign f… 
2185,gyuk | america's first openly gay presidential candidate quits race: pete buttigieg america's first openly gay ma… 
2186,"buttigieg and klobuchar ""behaved themselves"" the hell does that mean 😠 "
2187," bernie bernieorbust unionstrong greennewdeal medicareforall livingwage 

democratic candidat… "
2188, buttigieg was a supporter of bernie in then became a progressive candidate in realized he… 
2189,interesting that both buttigieg and klobuchar dropped out right before super tuesday and are supporting biden the… 
2190,probably called mayor pete buttigieg to console him hah 
2191,pete buttigieg will endorse joe biden via 
2192, said it best” leadership isn’t just about policy leadership is about what you draw out of people i… 
2193,"he’s crazy but i believe this
trump claims democratic primary 'rigged' against sanders after klobuchar buttigieg… "
2194," fun fact:
since ending his bid for the presidency pete buttigieg has declared himself a ""safe injection site"""
2195,pete buttigieg to endorse joe biden for president 
2196,klobuchar buttigieg endorse biden on eve of super tuesday | pbs newshour 
2197,obama called buttigieg to tell him that he has a bright future rat king 
2198,_pol maybe but a nh win wouldn’t have solved buttigieg’s severe problems with poc
2199, _ascending i was hoping buttigieg would get the nomination and pick sanders as the running mate… 
2200, can you give an explanation why people are sexist for this opinion or is it also homophobic to recomm… 
2201, it was recently revealed that pete buttigieg was parroting former president barack obama's candidacy… 
2202,klobuchar and buttigieg supporters who voted early in super tuesday states have had their votes rendered moot by th… 
2203,breakingnews biden momentum monday will join in dallas tonight sharing a stage with… 
2204," buttigieg and klobuchar both dropped out to help the ""moderates"" they both have done better t… "
2205," by that logic buttigieg should not have dropped out

but it's clear t… "
2206,with amy klobuchar and pete buttigieg both dropping out to endorse joe biden just before super tuesday consolidati… 
2207,if you think buttigieg's exit from the field only helps biden think again 
2208,watch to watch for super tuesday now that klobuchar and buttigieg are out 
2209,what is the real story of buttigieg's service and time in afghanistan 
2210,"word cloud around mentions of bernie 

main concerns: biden warren trump mentions of buttigieg klobuchar and e… "
2211,_ i’m not for buttigieg as defense sec lets try experienced leadership of someone like admiral mcraven if he’ll accept
2212,moderate democratic candidates buttigieg and klobuchar are doing what republicans refused to do in : getting ou… 
2213, it was recently revealed that pete buttigieg was parroting former president barack obama's candidacy speech… 
2214,pete buttigieg’s historic candidacy is over where do gay rights groups want to go from here the washington post 
2215,buttigieg planning to endorse biden 
2216, how do you know buttigieg and klobuchar wouldn’t have dropped out if biden lost to bernie in sc
2217,"i believe this is the first senate challenger to endorse biden (al sen doug jones also backs him)

among dsccen… "
2218,nolte: pete buttigieg’s failed campaign was built on hate and lies 
2219,who got klobuchar and buttigieg to appear on the same stage and not kill each other while they endorse biden ob… 
2220,'quid pro quo': trump suggests buttigieg and klobuchar dropped out for biden administration positions 
2221," 

hello the buttigieg’s

fyi — sanders will not complete the race because of a very… "
2222,klobuchar ends bid set to join buttigieg in biden endorsement ahead of super tuesday 
2223,buttigieg steyer klobuchar exit reveals need for ranked choice primary voting 
2224,it sure looks like both buttigieg and klobuchar are headed for biden's texas rally 
2225,omg if mayor pete stole his content he has no honest agenda i hope this is fake news~ mainstream media is ignor… 
2226,just found out that the ceo of my company voted for pete buttigieg hmmmmmuch to think about
2227," ""behaved themselves"" i do not like the way that sounds at all bloomberg buttigieg and klobuchar both a… "
2228, buttigieg & klobuchar out warren stays in establishment dems circle the wagon around biden why… 
2229, sorry to see pete buttigieg drop out but at least we all know now that we have a very capable man‼️🦅🇺🇸
2230,with gillibrand yang harris booker buttigieg and now klobuchar bowing out the democraticrace is far less div… 
2231,"pete supporter nothing but good experiences taking to the khive nothing but bad experiences with bernieworld

th… "
2232,"""for all the privileges buttigieg might have received as a white man he also earned the unluckiest bounce of the p… "
2233,pete buttigieg reportedly called joe biden before dropping out but called the wrong number here is what he said… 
2234," [biden will win this thing ]

that's not what i asked you so you would vot… "
2235, waiting for the buttigieg onlyfans
2236,wtiu's mitch legan reports on the former mayor of south bend pete buttigieg dropping out of the presidential race… 
2237,_benson she's performed worse than buttigieg and he beat her to dropping out of the race the polls do not even… 
2238,now that pete buttigieg and amy klobuchar have dropped out of the race are we about to see a huge rise in support… 
2239,people who have already turned in ballots for are out of luck there are no doovers in colorado's e… 
2240,yo wtf this is why i wanted buttigieg to stay in for super tuesday 
2241,klobuchar buttigieg to back biden at rally in super tuesday state of texas 
2242, i do not get how buttigieg could write an award winning essay on bernie sanders and then turn on him… 
2243,buttigieg and klobuchar are on board with biden joe should call senator warren right now and offer her the vp slot
2244,breaking: klobuchar and buttigieg end their presidential campaigns after bloomberg offers them billion each
2245,_avina it’s deceiving to pretend to be welcoming to buttigieg s… 
2246,klobuchar buttigieg bloomberg will all coalesce around biden the money is moving in his direction and this is th… 
2247,with the recent news that after meeting with biden's campaign both buttigieg and klobuchar dropped out with the l… 
2248," “amy klobuchar and pete buttigieg set to endorse biden at evening rally”

"
2249,pete buttigieg plans to endorse joe biden for the democratic presidential nomination 
2250,buttigieg set to endorse biden as super tuesday looms smartnews 
2251,pete buttigieg dropping out of presidential race 
2252, ) agrees with … 
2253,insiders tell me a private jet is about to take mayor pete to dallas to endorse joe biden and republicans tell me… 
2254,opinions | klobuchar and buttigieg appear ready to back biden is the party deciding 
2255,steger klobuchar and buttigieg will be valuable assets for progressives in the next elections some others will be… 
2256,shepard fairey endorsing buttigieg just makes so much sense
2257, according to that poll sanders is the second choice of % biden % and bloomberg % that's nea… 
2258,watch to watch for super tuesday now that klobuchar and buttigieg are out 
2259,"this case study of a single incident but for an entire year

pete buttigieg has the patience of a saint "
2260,pete buttigieg will endorse joe biden for democratic nomination 
2261,bernie bro’s welcome buttigieg bottoms
2262," mall is incredibly popular candidates ran on ""fixing"" obamacare not… "
2263, … 
2264,pete buttigieg drops out how this could impact the race via 
2265,lean over to a bewildered pete buttigieg supporter and whisper filibuster into their ear then share a determined n… 
2266,"very coolwecan do this
klobuchar chief of staff kamala for ag edwards management and budget buttigieg for v… "
2267,opinions | pete buttigieg and kamala harris reflected america as i know it 
2268,yugelybuttigieg&klobuchar sold their souls to dncnot a bernie fan but this so wrongfix has been in for quite s… 
2269, as some one pointed out biden citing medical reasons can drop out in aug or sept and the party… 
2270,"onlybernie sanders agrees with trump: ""they're staging a coup against bernie"" | zero hedge "
2271, canvassing in bay area this pundit sanders / warren vs biden isn’t accurate undecideds were looking at warr… 
2272, buttigieg can not get the black vote & the women running were old scolds bloomberg will not get black vote… 
2273,"i was a big fan of 

i’m sad she’s out but her timing is impeccable there is no doubt this was… "
2274,goodbye pete buttigieg you were always more of a symptom than a cure | richard wolffe 
2275,ufo crew surrenders to pete buttigieg (fiction) 
2276,have we ever had this many significant endorsements on one day mark kelly running for senate in arizona reid klo… 
2277,"opinion | homophobia hurt pete buttigieg — as much as america wished it did not
lessons from his campaign are an op… "
2278,it is worth noting that with buttigieg and klobuchar delegates joe biden has now surpassed bernie sanders and is t… 
2279,the fact that buttigieg and klobuchar are coming together to support this guy even in his current state is really t… 
2280,"new post: ""pete buttigieg will endorse joe biden for democratic nomination"" "
2281,"word cloud around mentions of biden 

main concerns: bernie pete buttigieg amy klobuchar trump endorsement "
2282," oh it has been ""arranged"" he can then hang out with buttigieg and share some prep h then the old commy… "
2283,"""pete buttigieg will endorse joe biden for democratic nomination"" by reid j epstein and trip gabriel via nyt "
2284," the reason is simple buttigieg and klobuchar pulled out and their votes will supposedly go to biden

sa… "
2285, elizabeth warren needs to drop out amy klobuchar and pete buttigieg have already done it they have rallied… 
2286,how the end of pete buttigieg's campaign is shaking up maine's primary | wgme 
2287,"after dropping out of the race for president pete buttigieg and amy klobuchar are backing joe biden
election 
"
2288,mayor pete flew sky high 
2289,"im confused the socialist party far left ideology presses race & gender bs 
always whining theyre marginalize… "
2290,"after dropping out of the race for president pete buttigieg and amy klobuchar are backing joe biden
election 
"
2291,silicon valley saw itself in pete buttigieg now he’s out of the race 
2292,klobuchar buttigieg to back biden at rally in super tuesday state of texas 
2293,i’m ready to drop on biden tonight once pete buttigieg endorses him peteindallas
2294,pete buttigieg’s historic candidacy is over where do gay rights groups want to go from here… 
2295, thank you mr buttigieg i am so proud of all that you represented i would vote for you again i h… 
2296,pete buttigieg will endorse joe biden for democratic nomination repete
2297," biden nabs klobuchar buttigieg backing on super tuesday eve

nervousdonaldtrump tweets this is… "
2298, i agree wholeheartedly we need more lgbtq people in government to support so many of those around us th… 
2299, beto buttigieg
2300,maybe everyone will drop out of the presidential race and endorse joe biden for president and andrew yang can… 
2301,buttigieg somehow always reminds me of butt plug 
2302,wr: pete learned that his proposition does not sense via 
2303,ah so the final rat move of pete buttigieg in this primary will be committing elder abuse with amy klobuchar
2304,buttigieg steyer klobuchar exit reveals need for ranked choice primary voting 
2305,maybe it's fine the second choice candidates of buttigieg and klobuchar voters are all over the map honestly warr… 
2306,“pete buttigieg might be the most progressive candidate ever to run for president | charles kaiser | us news | the… 
2307," _x cspan

"
2308,"amy klobuchar and pete
buttigieg are rallying around
joe biden hope those that have not voted follow their
lead… "
2309,primary update: buttigieg klobuchar and dnc set to suckle at crazy uncle joe’s senile teet ahead of supertuesday
2310, buttigieg drops biden wins sc and the market rally big time anyone think this is b/c it’s less likel… 
2311,"the obama factor

obama phone call encourages buttigieg to use his ‘considerable leverage’ amid rumors of biden… "
2312,pete buttigieg for vp where dems stand presuper tuesday 
2313,biden nabs klobuchar buttigieg backing on super tuesday eve smartnews
2314,josh hawley is far less nauseating to me than pete buttigieg
2315,"bloomberg says klobuchar and buttigieg ""behaved themselves"" after they drop out of race dems leave a nest of… "
2316,‘quid pro quo’: trump suggests buttigieg and klobuchar dropped out for biden administration positions | washington … 
2317, that is a sign that pete buttigieg was there 😂😂🤣🤣
2318,some people do not even know tomorrow is the election let alone that tom steyer amy klobuchar & pete buttigieg have… 
2319,pete buttigieg will endorse joe biden via 
2320,amy klobuchar pete buttigieg rally behind joe biden on eve of crucial super tuesday contests… 
2321,writer addresses four objections to ranked choice voting (rcv) 
2322, joe biden/pete buttigieg ticket kamala harris ag amy klobuchar new spokesperson… 
2323,if you are a warren supporter i implore you to please vote for bernie by her staying in it is splitting the progr… 
2324, buttigieg would make a great sec of state diplomatic tone speaks many languages military experience
2325,pete buttigieg to endorse joe biden for president 
2326,biden nabs klobuchar buttigieg backing on super tuesday eve 
2327,in the election pete buttigieg will be older than joe biden is now
2328,trump says end of buttigieg campaign is the beginning of dems' plan to stop sanders | fox news 
2329, buttigieg said that yesterday morning he was out by midday
2330, yeah well buttigieg and klobuchar are not foreign governments
2331," bloomberg says klobuchar and buttigieg ""behaved themselves"" after they drop out of race dems leave a… "
2332, whatever intentions she had once upon a time they're gone now it's been… 
2333," this also shows buttigieg voters going to warren over biden

super tuesday results are going to vary… "
2334,"and the lead:

south bend ind — pete buttigieg the former smallcity indiana mayor and first openly gay major pr… "
2335,"head/subhead on pete:

pete buttigieg drops out of democratic presidential race

the first openly gay major preside… "
2336,"thread
pete buttigieg was screwed screwed by his opponents (amy liz sanders) more importantly screwed by the m… "
2337,pete butttigieg and amy klobuchar are throwing their support behind joe biden after dropping out of the race t… 
2338,pete buttigieg drops out of the democratic presidential primary 
2339, pete buttigieg and amy klobuchar dropped out to give biden a chance against bernie
2340,pete buttigieg wanted to become the white obama but ended up being the gay jeb bush
2341,with buttigieg and klobuchar now out i've decided to go with warren if she does well tomorrow on st if she does n… 
2342,what happens to early votes already cast for klobuchar and buttigieg 
2343, _kong warren was widely projected t… 
2344,"give me a break

the media mourns pete buttigieg’s exit compares him to george washington "
2345,come on now i love ya and but you saw first hand her grit at that knock down debate… 
2346,"so far only one presidential candidate is mentioning coronavirus in facebook ads: michael bloomberg 

and since f… "
2347,"""buttigieg and klobuchar each flew to dallas on monday to support biden at a rally planned for the eve of super tue… "
2348,another payoff for buttigieg just like obama paid off bernie sanders to drop out of the race when running against… 
2349, its hard being in the spotlight but a pete only comes around once in a while go to target or albe… 
2350, maybe to be sanders vp knowing he will not live more years just like buttigieg with biden knowing h… 
2351,_huff it is i think the bloomberg / buttigieg split would force them to make a lot tougher ideological / pr… 
2352,pete buttigieg will endorse joe biden for democratic nomination 
2353, i am sending you the same message i sent to pete buttigieg i am sad that you are ending your preside… 
2354,"number of times the candidates used the word ""working"" in their iowa stump speeches:
sanders: 
warren: 
biden:… "
2355,"president trump on klobuchar and buttigieg dropping out: 

“i think it’s rigged against bernie they’ll say 'hey… "
2356,just found out ben folds supported pete buttigieg am quite disappointed
2357,pete buttigieg & amy klobuchar drop out to support joe biden | people tell tulsi gabbard to drop out too… 
2358,buttigieg and klobuchar to endorse joe biden; harry reid also backs former vice president 
2359, you know where you got the thought that to beat donald trump you have to do it in a cal… 
2360,i hope biden's team has the wisdom to see that pete buttigieg is the sharpest knife in the drawer i hope they do not squander him
2361,klobuchar and buttigieg fighting on the same team is going to be interesting
2362,biden surges higher with klobuchar buttigieg endorsements 
2363,'quid pro quo': trump suggests buttigieg and klobuchar dropped out for biden administration positions… 
2364,indystar's pete buttigieg journalists break down their past month covering the candidate 
2365,buttigieg wanted ma with the passion of me seeing frozen ii with my kids 
2366, that's how much buttigieg cares about his supporters who voted for him spent hours volunteering for him walked away
2367,bernie is furious he railed against the democratic establishment’s efforts to gang up against him as joe biden lin… 
2368,dnc forcing buttigieg out to endorse biden in an attempt to block sanders from the nomination lol
2369,buttigieg steyer klobuchar exit reveals need for ranked choice primary voting 
2370,i do want to emphasize that with a lot of delegates being decided soon every vote counts putting it all together… 
2371,amy klobuchar and pete buttigieg endorsing joe biden is absolutely devastating news for elizabeth warren… 
2372,christian group celebrates end of pete buttigieg’s campaign because he’s gay 
2373,"atlasintel california poll [//]:

sanders %
biden %
bloomberg %
warren… "
2374, _knight chris why are you ignoring elizabeth warren i just do not get it even before south c… 
2375,"new label from
sorry buttigieg
""trumpism deplorables""
we welcome all 
name calling
""deplorable news""
taking a time out to see
the rally"
2376,just think of the millionaires and billionaires that contributed large sums of money to buttigieg's campaign right now
2377,_snyder _jacobsen that makes chris pratt pete buttigieg
2378,and as for my earlier tweet saying something is smelling funky in this whole dem race/ weird drop out timing now t… 
2379,klobuchar ends bid set to join buttigieg in biden endorsement ahead of super tuesday … 
2380,"i agree
"
2381,"biden races to lock down moderates as buttigieg and klobuchar exits rock rapidly shifting race

"
2382,"buttigieg to endorse biden at dallas rally

"
2383,"opinion: the significance of mayor pete

"
2384,flash: what the buttigieg withdrawal means for super tuesday — and the rest of the primary contest 
2385,"amy klobuchar ends bid set to join pete buttigieg in biden endorsement ahead of super tuesday

"
2386," as with all centrist campaigns he's banking on the ""antithin… "
2387, _rob is not your gm a pete buttigieg fan
2388,_ president: warren vp: julian castro ag: kamala harris epa: jay inslee defense secretary: william… 
2389, i'm a heavy reader who never had much of an interest in sports i prefer arts and crafts to lik… 
2390,why so many pete buttigieg supporters are suddenly turning to bernie sanders via 
2391,"klobuchar ends bid set to join buttigieg in biden endorsement ahead of super tuesday

"
2392, most but still not a majority but even then ma… 
2393,biden nabs klobuchar buttigieg backing on super tuesday eve nn 
2394, bernie folks even leaders like shaun king stoop to making s… 
2395,from : amy klobuchar and pete buttigieg endorsing joe biden is absolutely devastating news for elizabeth… 
2396,"my wife saw the billionaires got amy klobuchar to drop out so she immediately gave to bernie

i heard that but… "
2397,_train democrats like biden buttigieg and klobuchar are making me extra proud to b… 
2398, vote with your heart and your head don’t know why you distrust biden he seems to me like a great hu… 
2399,amy klobuchar and pete buttigieg endorsing joe biden is absolutely devastating news for elizabeth warren… 
2400, gut instinct is it’s partly coincidental and partly contagious (biden and bloomberg might not have ente… 
2401, _train stop with the racism 
2402,the fix is in what cabinet positions did offer klobachar and buttigieg for their complicity
2403,"poor ⁦⁩ thinks he’s in good shape as candidates with almost no support throw it his way delusional

klob… "
2404,"would make sense to have ranked voting
or do not put your ballot in early if you voted for klobucharbuttigieg or… "
2405, i feel that by encouraging buttigieg and klobachar to drop out the dnc is also forcing eliz… 
2406,honestly by buttigieg will likely have a whole new campaign lined up he improved during this cycle even tho… 
2407, … 
2408,still i do not want to make too big a deal of this ideological breakdown buttigieg was only polling in the low dou… 
2409, _polls _intel nope you’re factoring in an outdated poll without the drop outs… 
2410,buttigieg drops out of democratic race after slamming own plan to be president as ‘naive unrealistic pipe dream’ 
2411,what pete buttigieg understood 
2412, it makes me sick that it's even that close honestly but it also makes sense because buttigieg was su… 
2413, pete buttigieg and his husband guess which one is pete
2414,so disappointed in buttigieg for endorsing biden i’d thought he’d wait for the nominee… 
2415,i'm predicting that bernie sanders and elizabeth warren will join forces to go up against the joe biden + pete butt… 
